id,bid,正文,头条文章url,原始图片url,视频url,位置,日期,工具,点赞数,评论数,转发数,话题,@用户
4616481788396776,K6ULwzenS,#中美高层战略对话#看这个想起来看了好多遍的那年那兔那些事，种花家加油 ,,,,,2021-03-19,,1,0,0,中美高层战略对话,
4616436998210366,K6TBhyrTg,#成毅梦醒长安# 我要开始做法了，明天礼拜六日天庭公务员休息，没有办法审批我的心愿，下个礼拜才能给我反馈 ,,,,,2021-03-19,,9,7,0,成毅梦醒长安,
4616153467194454,K6MdYubBA,诚意算不算免费客串了一部剧 ,,,,,2021-03-18,,0,7,0,,
4616151957244176,K6Mbxuoxy,有的人就是学不会体面 ,,,,,2021-03-18,,0,4,1,,
4616072018532147,K6K6BzNBh,#动物##宠物# 都是园长先生的小可爱(๑• . •๑) 手上有颗水晶球的微博视频 ,,,"https://f.video.weibocdn.com/wQ3Nh1HMlx07Lbm0QHvq01041200aRwZ0E010.mp4?label=mp4_720p&template=720x1280.24.0&trans_finger=c3f00996be5378650057cf237d7bfffd&ori=0&ps=1CwnkDw1GXwCQx&Expires=1620491372&ssig=V935dOq9BF&KID=unistore,video",,2021-03-18,微博视频号,2,8,0,"动物,宠物",
4615801325752639,K6D40o8wv,少吃点洗脑包吧！没事干给别人当免费的运输员，专注自家贴脑门上 ,,,,,2021-03-17,,2,2,0,,
4615701808026082,K6AtuxFWW,天气太热，每天连吃饭的胃口都没有了 ,,,,,2021-03-17,微博 weibo.com,0,0,0,,
4615461948359694,K6ueCz4JM,#沉香如屑#@优酷 开机那天充一年会员，上映当日充一年，超点开始充一年，三年会员送给沉香如屑，成毅应渊帝君绝色无双 ,,https://wx2.sinaimg.cn/large/de84360cgy1golzjrqmdcj20xc1q5wwx.jpg,,,2021-03-16,,32,2,0,沉香如屑,优酷
4615449298337872,K6tUdyZ3O,#成毅沉香如屑#等风等雨，等成毅，优酷加油欢瑞加油，@优酷 我是你7年多的忠实用户，果然没有爱错你 ,,https://wx1.sinaimg.cn/large/de84360cgy1goly23an7rj20go0lfadp.jpg,,,2021-03-16,,2,1,0,成毅沉香如屑,优酷
4615433083160664,K6tu4dges,#烫发翻车现场#烫发翻车人本翻在这里我在忍忍过段时间重新搞个发型 ,,,,,2021-03-16,,0,3,0,烫发翻车现场,
4615422282564386,K6tcEaL74,早知今日何必当初 ,,,,,2021-03-16,,0,7,0,,
4615358436608421,K6rxFrJ9r,小狗狗真的好可爱 手上有颗水晶球的微博视频 ,,,"https://f.video.weibocdn.com/0047oqbDgx07L8dhznIk01041200pMVX0E010.mp4?label=mp4_720p&template=720x1280.24.0&trans_finger=c3f00996be5378650057cf237d7bfffd&ori=0&ps=1CwnkDw1GXwCQx&Expires=1620491386&ssig=oa5md1cGs6&KID=unistore,video",,2021-03-16,微博视频号,0,2,0,,
4615351562668317,K6rmAbc9n,这声势浩大皆为他而来，所以果子们放宽心继续做数据舔屏，业内门清的很 ,,https://wx3.sinaimg.cn/large/de84360cgy1golmu54zppj20tt0gidj5.jpg,,,2021-03-16,,0,7,0,,
4615195487896117,K6niQx88J,希望造谣我的那个CY的同事粉能感受到我的善意，毕竟脱离网络才是真实人生，要好好感谢善良的IE姐姐一直苦口婆心私信我，在帮你说好话，确实，搞到现实生活也许会影响一个人一生，不管是不是同担，我希望以后你能快乐追星，粉圈喷见怪不怪，但和造谣对人伤害指数是不对等的，法律上也轻重不一样，追星先要学会保护自己，将心比心来一句，我不是那种特意想搞事的人，那你这样碰到其他人，怎么办？话说到这里我就不艾特了，前面我发的也设置了，好自为之,,,,,2021-03-16,,7,2,0,,
4615165796683168,K6mwXs2B2,成毅粉圈真的是我开了微博许多年目前见过的特别好的粉圈，素质修养均处于上层，对，不用因为黑子的PUA怀疑自己，她们打的什么目的，马上就知道了，大家照常一样每天快乐吸淇，做数据就好了，一个字“稳” ,,,,,2021-03-16,,167,27,2,,
4615150834814200,K6m8Pkcoo,自从成毅宣了沉香如屑男一号就炸了黑子的窝，可惜成毅没有黑点，所以只能从粉丝下手，每次用的招都是先僚然后只要有个上钩就老一套来了，不然怎么说原来是一家人呢，套路流程一模一样，看黑稿和黑子这么矜矜业业，我才知道，原来成毅真的超级火了，谢谢用这么多套路和黑稿来向我这个成毅粉丝证明他超级火，因为我本人一直觉得他就是个小演员而已,,,,,2021-03-15,,153,22,1,,
4615078219353756,K6kfHDfl2,我上午发的要离开了，这就又给我虐回来了果子们，我只短暂的离开了几个小时，我又回来了 ,,,,,2021-03-15,,3,2,0,,
4614983092536565,K6hMhaDSl,私信从今天之后我就不回了，不是不爱，是太爱 ,,,,,2021-03-15,,1,0,0,,
4614777995264359,K6crtm5v1,我特么快累死了，现在还没回到家就睡了3个多小时，成毅沉香如屑艾派德 ,,https://wx4.sinaimg.cn/large/de84360cgy1gojt18zjy6j20u012xwnn.jpg,,,2021-03-14,,4,2,0,,
4614242898020980,K5YwpxECE,成毅 沉香如屑，爱你不悔 ,,,,,2021-03-13,剧版沉香如屑超话,0,0,0,,
4613908783956337,K5PPwgBdT,#成毅# 淇淇太好看了这身帝君造型，我直接疯掉，成毅穿古装太特么仙了，救命 手上有颗水晶球的微博视频 ,,,"https://f.video.weibocdn.com/0029ETB1gx07L1PGSNGD01041200SoHt0E010.mp4?label=mp4_ld&template=360x780.24.0&trans_finger=81b11b8c5ffb62d33ceb3244bdd17e7b&ori=0&ps=1CwnkDw1GXwCQx&Expires=1620491391&ssig=xSarjmneUB&KID=unistore,video",,2021-03-12,微博视频号,3,0,0,成毅,
4613896155955293,K5Pv9oZf7,#成毅# 我可爱的淇淇在直播间淇淇妈妈爱你o(≧v≦)o又想哭了(┯_┯)这动起来的造型太好看了，成毅加油 手上有颗水晶球的微博视频 ,,,"https://f.video.weibocdn.com/004nOhrdgx07L1Mf6Ane010412009x1T0E010.mp4?label=mp4_ld&template=360x780.24.0&trans_finger=81b11b8c5ffb62d33ceb3244bdd17e7b&ori=0&ps=1CwnkDw1GXwCQx&Expires=1620491393&ssig=w%2F22yaFLX5&KID=unistore,video",,2021-03-12,微博视频号,54,17,7,成毅,
4613653875130795,K5JcnlwKL,妈呀明天能近距离看淇淇，淇淇还带妆线上的我柠檬精了 ，成毅加油手上有颗水晶球的微博视频 ,,,"https://f.video.weibocdn.com/003Xj6MNgx07L0I84UfZ010412005fPu0E010.mp4?label=mp4_720p&template=720x1282.24.0&trans_finger=c3f00996be5378650057cf237d7bfffd&ori=0&ps=1CwnkDw1GXwCQx&Expires=1620491393&ssig=tX7IfqBB9S&KID=unistore,video",,2021-03-11,微博视频号,0,2,0,,
4613634749106094,K5IHwCcUu,@欢瑞世纪 个狗币，自己没搞定的事情整的跟个明白人一样，骗了那么多成毅的粉丝万水千山几百几千公里乘坐各种交通工具跑过去，那么多附近的几十公里自己开一下午车过去，结果啥也不是都被你骗了，开这么大一个玩笑，像闹着玩一样操作，还让这么多人怀揣着爱陪你玩 ，你对不起成毅，对不起成毅的粉丝,,,,,2021-03-11,,13,2,0,,欢瑞世纪
4613275025148867,K5zlklBsf,#成毅# 和成毅一起合拍 手上有颗水晶球的微博视频 ,,,"https://f.video.weibocdn.com/002PavpPgx07KZ2KvHCE010412005fPu0E010.mp4?label=mp4_720p&template=720x1282.24.0&trans_finger=c3f00996be5378650057cf237d7bfffd&ori=0&ps=1CwnkDw1GXwCQx&Expires=1620491393&ssig=GLU94UgwEp&KID=unistore,video",,2021-03-10,微博视频号,1,0,0,成毅,
4613240573395114,K5yrLefdU,#建议取消1至3年级家庭作业#小学有一年换上来一个很开明的校长，不让给低年级的留家庭作业，那段时光记到现在，小小少年，恣意玩耍 ,,,,,2021-03-10,,1,0,0,建议取消1至3年级家庭作业,
4612279947757593,K59smwy6t,上阳赋结局看到一个超级搞笑的弹幕：苏妲己都不如你王懁厉害 ，于和伟演技真好，原音真舒服 ,,,,,2021-03-08,,0,0,0,,
4612128176083258,K55vzpwx4,在网易云音乐一直循环成毅的六月的雨唱的好好听 ,,https://wx4.sinaimg.cn/large/de84360cgy1gobcpspwcdj215i0oj7tj.jpg,,,2021-03-07,,18,2,1,,
4611194700693515,K4HdY2UpJ,在网易云音乐里7年多的耕耘，收藏700多首，好久没听歌，今天进去听怎么这么多没了版权，也是扼腕，连电音徐梦圆都留不住 ,,https://wx4.sinaimg.cn/large/de84360cgy1go8dfxhzuvj20u0122aeo.jpg,,,2021-03-05,,2,6,0,,
4611184958113338,K4GYfy2Ei,听歌听嗨了，不想睡觉了 ,,,,,2021-03-05,,0,0,0,,
4611025427499799,K4COWvt2v,╰😁╯╰😁╯╰😁╯╰😁╯╰😁╯╰😁╯╰😁╯╰😁╯╰😁╯╰😁╯╰😁╯╰😁╯╰😁╯╰😁╯╰😁╯╰😁╯@成毅 @黑人牙膏官方微博 ,,https://wx3.sinaimg.cn/large/de84360cgy1go7u29htv2j20ku0kuqaw.jpg,,,2021-03-04,,1,2,0,,"成毅,黑人牙膏官方微博"
4610762402697130,K4vYIbjE6,司凤受打妖鞭，我都感觉痛，成毅演的太好了(´;︵;`) ,,,,,2021-03-03,,4,0,0,,
4610752743213006,K4vJ8dtQG,今天成毅的司凤要受打妖鞭了 ,,,,,2021-03-03,,1,0,0,,
4610334948068700,K4kRgxR2k,#赵丽颖黑长直 病娇美人# 我的明兰长大了，女王范十足 ,,,,,2021-03-02,微博搜索,3,4,0,赵丽颖黑长直 病娇美人,
4610243067119900,K4it4tSd6,知道成毅从来没有被偏爱过，但是粉丝想捧在手心的人，却被别人狠心丢在角落里，他努力发着热想感染身边所有人，不求所有人偏爱于他，只求不伤害就这么难吗？为什么要一次一次拿起来却在高处放手让砸到地上碎掉@成毅工作室 ,,,,,2021-03-02,微博 weibo.com,8,2,0,,成毅工作室
4610061936624888,K4dKVrNr2,十年了，终于你努力的让更多人看到了你，加油《追光吧！哥哥》纯享版：《21》肖顺尧 追光吧哥哥的优酷视频 （分享自 @优酷PC客户端）无限循环 ,,,https://api.youku.com/videos/player/file?data=WcEl5oUuQdTVPVE0xTWpJNE5BPT18MHwxfDEwMDUwfDAO0O0O,,2021-03-01,微博视频号,1,0,0,,优酷PC客户端
4610055469008173,K4dAuBNr7,有沟，对不起了司凤(T ^ T)成毅的整肃别揍我我之前也是整肃 ,,https://wx3.sinaimg.cn/large/de84360cgy1go4qlp7hylj20k00zkmzk.jpg,,,2021-03-01,,2,2,0,,
4610044630925988,K4dj13STi,#成毅# 司凤一只小鸟天天在鸟窝里蹲着孵一颗蛇蛋，然后孵出来一只小白蛇（小银花），想想就特别搞笑〜(￣▽￣〜) ,,,,,2021-03-01,,1,1,0,成毅,
4609707429595492,K44x8Ege0,今年罗小黑战记又看了一遍求个二吧！我一定去贡献票房，不管拍成啥|･ω･｀)我一定要给一补一张门票，太好看了(｡･ω･｡)ﾉ♡ ,,,,,2021-02-28,,0,3,0,,
4609507407691988,K3Zkwwh2k,我刚使用会员特权送给了@成毅 3朵鲜花，希望陪你从开始到未来的每一个高光时刻，我们一起走花路吧！成毅已收到341025朵花 ,,,,,2021-02-28,明星势力榜鲜花,0,0,0,,成毅
4609272941904537,K3Tem7Zsl,#吴孟达去世#很遗憾，谢谢带来那么多的欢乐作品陪伴我长大，我想不止我一个人 ,,,,,2021-02-27,,0,0,0,吴孟达去世,
4608936709983893,K3Ku2FTgx,#2020年微博热度TOP10剧星#CY#成毅琉璃#成毅的禹司凤，永远的白月光，感谢去年夏天一只小鸟落我肩 ，我会爱你一万年 ,,"https://wx4.sinaimg.cn/large/de84360cgy1go163utz00j22lx2c0npe.jpg,https://wx3.sinaimg.cn/large/de84360cgy1go163zkl7ej225y1ignpd.jpg,https://wx2.sinaimg.cn/large/de84360cgy1go16409lsvj20go0go0wq.jpg,https://wx4.sinaimg.cn/large/de84360cgy1go1640w95vj20u0177dih.jpg,https://wx1.sinaimg.cn/large/de84360cgy1go1648oh46j20jg0jgq4f.jpg,https://wx2.sinaimg.cn/large/de84360cgy1go16423e2yj20u01hc40x.jpg,https://wx4.sinaimg.cn/large/de84360cgy1go1647ifg5j21lo0y9x6p.jpg,https://wx4.sinaimg.cn/large/de84360cgy1go1647xoatj20zk0npmz1.jpg,https://wx1.sinaimg.cn/large/de84360cgy1go1648bu7cj20n50dxq8k.jpg,https://wx3.sinaimg.cn/large/de84360cgy1go164cak9rj22ai38oe81.jpg,https://wx2.sinaimg.cn/large/de84360cgy1go164fn9e1j21hc0u07wh.jpg,https://wx3.sinaimg.cn/large/de84360cgy1go164hy83ij20w71o04kd.jpg,https://wx2.sinaimg.cn/large/de84360cgy1go164iih6cj20u0190djc.jpg,https://wx1.sinaimg.cn/large/de84360cgy1go164zaegwj20yi1pce81.jpg,https://wx2.sinaimg.cn/large/de84360cgy1go16530h7rj21111jkb29.jpg",,,2021-02-26,HUAWEI Mate 20 Pro,5,3,0,"2020年微博热度TOP10剧星,成毅琉璃",
4608625706799895,K3CoqswXJ,#琉璃开启新地图#cy#成毅琉璃# 听宝宝司凤的话，每天晚上7点半江苏卫视看琉璃，成毅麻麻爱你，吧唧一口小脸蛋 ,,"https://wx2.sinaimg.cn/large/de84360cgy1go06fnxlyoj22lx2c0npe.jpg,https://wx3.sinaimg.cn/large/de84360cgy1go06fwe3x6j225y1ignpd.jpg,https://wx1.sinaimg.cn/large/de84360cgy1go06fxgtjzj20go0go0wq.jpg,https://wx2.sinaimg.cn/large/de84360cgy1go06fydturj20u0177dih.jpg",,,2021-02-25,Android,6,0,1,"琉璃开启新地图,成毅琉璃",
4607823152154416,K3hvZ92sE,@成毅工作室 要饭饭 ,,https://wx4.sinaimg.cn/large/de84360cly1gnxmae4draj20jg0jgq4f.jpg,,,2021-02-23,Android,15,9,1,,成毅工作室
4607048937115610,K2XnftR5U,#成毅理想照耀中国# 成毅的可爱真的犯罪 ,,https://wx3.sinaimg.cn/large/de84360cgy1gnv5cse4gmj20u01900w9.jpg,,,2021-02-21,Android,6,0,0,成毅理想照耀中国,
4607034752500945,K2X0nauBP,分享单曲 要命的烦恼(特别版) (@网易云音乐) 爷青回，一首歌回到高中，MIC男团加油 ,,,,,2021-02-21,Android,0,0,0,,网易云音乐
4606763759045356,K2PXhBX6Q,洗澡盆要来了快，洗澡盆#琉璃上星# CY#成毅禹司凤# ,,,,,2021-02-20,Android,1,0,0,"琉璃上星,成毅禹司凤",
4606403661273493,K2GAu5lid,小结巴又来了想起来了去年的夏天，成毅禹司凤永远滴神#琉璃上星# CY#成毅禹司凤# ,,https://wx1.sinaimg.cn/large/de84360cgy1gnt3f857toj21ei0u0b29.jpg,,,2021-02-19,Android,4,1,0,"琉璃上星,成毅禹司凤",
4606400313956465,K2Gv5gBfX,快全家各种播放器上，哈哈鸟妈要给鸟加劲儿顶收视率#成毅禹司凤# ,,,,,2021-02-19,Android,1,0,0,成毅禹司凤,
4606389476130932,K2GdBpIW0,#琉璃上星#CY#成毅禹司凤# 麻麻的小鸟今天要归巢了 ,,https://wx3.sinaimg.cn/large/de84360cgy1gnt1mn19xsj20zk0npac4.jpg,,,2021-02-19,Android,5,2,0,"琉璃上星,成毅禹司凤",
4606374883627584,K2FQ4fdHq,#琉璃上星#成毅禹司凤，惊艳了整个夏日的小凤凰 ,,"https://wx3.sinaimg.cn/large/de84360cgy1gnszqlvjhoj20jl0u0q6n.jpg,https://wx2.sinaimg.cn/large/de84360cgy1gnszqm8cedj20u01aotc9.jpg,https://wx4.sinaimg.cn/large/de84360cgy1gnszrsrekdg20ku0m01l8.gif,https://wx3.sinaimg.cn/large/de84360cgy1gnszss5h5ug20o60ehhe3.gif,https://wx1.sinaimg.cn/large/de84360cgy1gnszt4xmzeg20qo0f07wk.gif,https://wx2.sinaimg.cn/large/de84360cgy1gnszuqj4dog21c00r0npu.gif,https://wx4.sinaimg.cn/large/de84360cgy1gnszx50fhfg20p70mfhej.gif,https://wx2.sinaimg.cn/large/de84360cgy1gnszxi79g0g20q50epkk1.gif,https://wx3.sinaimg.cn/large/de84360cgy1gnszxl2be3g20g50ar1kz.gif,https://wx4.sinaimg.cn/large/de84360cgy1gnszxu5c6ig20og0mokjx.gif,https://wx3.sinaimg.cn/large/de84360cgy1gnszy72ytcg20n80jge8j.gif,https://wx3.sinaimg.cn/large/de84360cgy1gnszyhwkkfg20y50hzhe8.gif,https://wx1.sinaimg.cn/large/de84360cgy1gnszyiscrjj20u016gtog.jpg,https://wx4.sinaimg.cn/large/de84360cgy1gnszyj8uo5j20go0nmafe.jpg,https://wx1.sinaimg.cn/large/de84360cgy1gnszyjugrrj20u01hcdnc.jpg",,,2021-02-19,Android,6,2,0,琉璃上星,
4606374539955736,K2FPvFLWo,#琉璃上星#成毅禹司凤破碎感好足 手上有颗水晶球的微博视频 ,,,"https://f.video.weibocdn.com/001DHCcDgx07KuFHOqCH010412008z3w0E010.mp4?label=mp4_720p&template=720x1264.24.0&trans_finger=c3f00996be5378650057cf237d7bfffd&ori=0&ps=1CwnkDw1GXwCQx&Expires=1620491514&ssig=7cn3zrW6BT&KID=unistore,video",,2021-02-19,Android,1,0,0,琉璃上星,
4606054307990733,K2xv0xwKN,#成毅# 我快笑死了，可可爱爱的天线宝宝淇淇子 手上有颗水晶球的微博视频 ,,,"https://f.video.weibocdn.com/002mLFeCgx07KtgjVTqg01041200dnQz0E010.mp4?label=mp4_720p&template=720x1280.24.0&trans_finger=c3f00996be5378650057cf237d7bfffd&ori=0&ps=1CwnkDw1GXwCQx&Expires=1620491514&ssig=QcvJ77ISKw&KID=unistore,video",,2021-02-18,Android,1,1,0,成毅,
4605319248102074,K2enqxZIC,#王劲松# 演技超级好的老爷子 ，特别有风骨，是从多会儿开始崇拜的呢？四年前的琅琊榜就开始了 手上有颗水晶球的微博视频 ,,,"https://f.video.weibocdn.com/003jNnpcgx07Kq1JeHDW010412006z8v0E010.mp4?label=mp4_720p&template=720x1280.24.0&trans_finger=c3f00996be5378650057cf237d7bfffd&ori=0&ps=1CwnkDw1GXwCQx&Expires=1620491514&ssig=sU0RgUSB8U&KID=unistore,video",,2021-02-16,Android,1,2,0,王劲松,
4603631849964759,K1wtOFOhV,大半夜我不睡觉居然截到了一堆1717@成毅 ,,https://wx4.sinaimg.cn/large/de84360cly1gnk8xcx7u7j20ts0kzacl.jpg,,,2021-02-12,Android,12,4,0,,成毅
4603581485559276,K1vaAnkdK,成毅 ,,,,,2021-02-12,Android,0,0,0,,
4602879056285167,K1cTDqn3F,成毅，这个用一部古装仙侠剧琉璃，温暖了我整个夏天的男孩子，成毅禹司凤，古偶封神角色演绎，尹涛导演、邓细斌制片、琉璃整个台前幕后的人员，谢谢你们，让这个男孩在2020年的夏天华丽绽放 ,,https://wx2.sinaimg.cn/large/de84360cgy1gnhubetf6ij20u01hcwjy.jpg,,,2021-02-10,Android,53,1,0,,
4602835071936858,K1bKH87RE,#琉璃#成毅连雨天奔跑的背影都让我能遐想出一堆江南少爷文，恭喜成毅的琉璃上星播出 ,,https://wx2.sinaimg.cn/large/de84360cgy1gnhpchnc5lj21hc0u07wh.jpg,,,2021-02-09,Android,18,2,0,琉璃,
4602827572518695,K1byBaze7,#琉璃#成毅禹司凤2月19上线江苏卫视黄金档，琉璃美人禹司凤 ,,https://wx1.sinaimg.cn/large/de84360cgy1gnhok1cnfeg20j60jehe8.gif,,,2021-02-09,Android,24,1,0,琉璃,
4602731102997294,K1930czJs,电视剧琉璃听说我的琉璃美人离泽宫长公主禹司凤要上星了👏，禹司凤小美人要被更多的人知道了呀 @成毅 蛊惑仔 ,,,,,2021-02-09,电视剧琉璃超话,11,6,0,,成毅
4601737866133684,K0Jd0pJEo,开始每年最少三遍的这就是街舞第一季的打卡，每年看，每年都要说无数句亮亮牛逼，胡浩亮牛逼 ,,,,,2021-02-06,Android,3,0,0,,
4601214556180850,K0vAXpVV8,今日下单哈哈，成毅加油@雀巢怡养 为了成毅甘愿成为中老年 ,,https://wx1.sinaimg.cn/large/de84360cgy1gncj9r2ehfj20u01t07wh.jpg,,,2021-02-05,Android,0,2,0,,雀巢怡养
4600970413358298,K0pfbe5E6,成毅雀巢京东直播开始了，为避免走错另一个直播间，点我这个链接直接进【雀巢京东自营旗舰店】正在直播，邀请你速来看看 来京东直播看【成毅的“礼想”春节】@京东 网页链接 ,,https://wx4.sinaimg.cn/large/de84360cgy1gnbr8wwcnpj202s023jr6.jpg,,,2021-02-04,Android,0,0,0,,京东
4600933474900184,K0ohBkyLe,果子们今天你们的要点是什么？是看成毅的直播，那今天为什么YXH不请自来？因为知道今天果子会很多在网上，那果子要去给各种YXH眼神吗？不给，知道吧！YXH就是在你最敏感的神经上蹦迪，让你忍不了然后去给他评论，不管如何都要乖，听话，别去管那些，那为什么YXH会这样写呢？因为你的浏览量和评论点赞转发等，都是他们的绩效，只要果子经常把看到的YXH屏蔽拉黑，保持这俩点，时间久了，他们觉得在IE这边赚不到绩效，就不发了，懂了吧(￣∀￣),,,,,2021-02-04,Android,5,2,0,,
4599435491028966,JFILP4jGe,黑子都是报喜鸟，难道这么久了还不知道吗？既然给报喜了，那咱们就安静的慢慢等着就完事了，我这个韭菜又壮了放一张成毅的小哥镇楼 ,,https://wx1.sinaimg.cn/large/de84360cgy1gn6uya115zj21111jkb29.jpg,,,2021-01-31,Android,29,2,0,,
4599424354883820,JFItRkuvi,成毅好TM惨一男子，今天又是被虐的一天，我去看看买点啥成毅的商务，淇淇妈妈保护你 ,,,,,2021-01-31,Android,68,9,0,,
4598785503661802,JFrRsfmBk,#央视春晚彩排#成毅前面有个词条的，看成毅粉丝带的词条就知道了，谁能知道咋全进来这个词条里面了，大概是带的词条里包含了这几个字 ,,,,,2021-01-29,Android,16,0,0,央视春晚彩排,
4598758434674164,JFr9NjBXK,#成毅现身央视春晚彩排#好希望成毅能过春晚筛选 ,,https://wx3.sinaimg.cn/large/de84360cgy1gn4pkrey99j20cr0crdgd.jpg,,,2021-01-29,Android,10,8,0,成毅现身央视春晚彩排,
4598750901968291,JFqXE8g2D,#成毅现身央视春晚彩排#成毅一身黑衣和我今天撞衫了，因为疫情不给政府舔乱我选择留在外地今年自己一个人过年，本来觉得除夕那天我会很难过遗憾，现在看到这个消息，无比希望成毅能最后通过几轮彩排，我能大年三十的晚上看到他穿着一身红在春晚活力四射的表演，成毅一个踏实敬业的演员，粉丝奇异果会排排队，一直跟着他走啊走，forever,,"https://wx3.sinaimg.cn/large/de84360cgy1gn4o4vab5ij20u011vn18.jpg,https://wx4.sinaimg.cn/large/de84360cgy1gn4o4w37wmj20u014o44k.jpg,https://wx1.sinaimg.cn/large/de84360cgy1gn4o4wkh8jj20p90p8jt7.jpg",,,2021-01-29,Android,66,25,0,成毅现身央视春晚彩排,
4598714343887033,JFq0Ggjc5,@成毅工作室 我想吸淇了，能不能给我放一口 ,,https://wx4.sinaimg.cn/large/de84360cgy1gn4k53cyctj20cr0crdgd.jpg,,,2021-01-29,Android,3,0,0,,成毅工作室
4598709042027247,JFpS88vnx,每次虐我，我就想干点啥，我今天又去买东西支持成毅了，成毅妈妈爱你o(≧v≦)o ,,https://wx4.sinaimg.cn/large/de84360cgy1gn4ksu6kt0j20jg0jg0tq.jpg,,,2021-01-29,Android,8,6,0,,
4598666998058952,JFoMjxOv6,成毅的果果这次很棒，凌晨和控评守广场到3点钟我睡了的，控评组应该有人通宵了吧！控评的姐妹辛苦了(≧∇≦)/，点赞 ,,,,,2021-01-29,Android,14,6,1,,
4598645636473595,JFodRra4P,连女二都舔不到，一个多月的舔饼营销钱白花了？莫不是被圈里人都知道该女士是怎么荼毒合作艺人和制片人辛苦筹集资金拍的剧了吧！！！所以说人要有良心，没良心的事情干多了老天爷都看不过去 ，大闸蟹iPad ,,https://wx3.sinaimg.cn/large/de84360cgy1gn4c6tw8mjj20v911utfy.jpg,,,2021-01-29,Android,7,4,0,,
4598518289533949,JFkUsE0dn,大晚上看小丑全体出动表演，难见这么蠢的一窝，哈哈，真的不是一个level，太次，不是一个水平多看一眼都拉低了眼界 ,,,,,2021-01-29,Android,2,0,0,,
4598509938675634,JFkGZAoVA,这和那次的黑比简直毛毛雨，咱们那三天三夜都过来了，还在乎这点拙劣求撕求给热度的把戏？放开眼界，咱们要做的是堂堂正正大步向前的走，我相信公道虽迟但总会到，成毅我最喜欢的演员，我会一直陪着你 ,,,,,2021-01-29,Android,29,1,1,,
4598496990337078,JFkm71pGK,想一下穿越到自己60岁，现在的每一天都在重复，如此重复几十年太没意思了 深圳 ,,,,深圳,2021-01-29,Android,0,0,0,,
4598384990360592,JFhrt1vO0,#新iPhone在中国创下历史最高纪录#来个全国在用新iPhone用户百分比表看看哪里用的人最多 ,,,,,2021-01-28,微博搜索,5,17,0,新iPhone在中国创下历史最高纪录,
4598034182453496,JF8jEaigw,#黄子韬 娱乐圈门槛真的越来越低#说到了结症上 深圳 ,,,,深圳,2021-01-27,Android,2,0,0,黄子韬 娱乐圈门槛真的越来越低,
4597962695515283,JF6sln8Mb,买年货就上京东超市成毅好帅(｢･ω･)｢嘿京东超市霸霸威武霸气，我先去京东超市给自己给爸妈买年货咯！！！ 深圳 ,,https://wx1.sinaimg.cn/large/de84360cgy1gn25sp11p6j20u01t0hdt.jpg,,深圳,2021-01-27,Android,4,4,0,,
4597779836177664,JF1HppV5K,为了截图退出微博重新进汰渍霸霸好给力@成毅 ,,https://wx1.sinaimg.cn/large/de84360cgy1gn1kt5s9gaj20u01t0hdt.jpg,,,2021-01-27,Android,8,1,0,,成毅
4597667646932356,JEYMst5qc,电视剧梦醒长安等成毅等李火火，梦醒长安万事大吉 ,,https://wx2.sinaimg.cn/large/de84360cgy1gn17xolsqvj20u01t0x3k.jpg,,,2021-01-26,电视剧梦醒长安超话,10,12,1,,
4597388847622657,JERwMvZ05,祈祷未来一年风调雨顺，国泰安康(ღ˘⌣˘ღ) 手上有颗水晶球的微博视频 ,,,"https://f.video.weibocdn.com/002lBQAfgx07JR7Dcx2v010412005TkS0E010.mp4?label=mp4_720p&template=1280x720.25.0&trans_finger=1f0da16358befad33323e3a1b7f95fc9&ori=0&ps=1CwnkDw1GXwCQx&Expires=1620491534&ssig=6DL0Z0H1zt&KID=unistore,video",,2021-01-25,Android,0,0,0,,
4597310916666188,JEPv5rYba,#上海14天隔离期间发现复阳病例30多例#希望疫情快快退去 ,,,,,2021-01-25,Android,0,0,0,上海14天隔离期间发现复阳病例30多例,
4597310652949990,JEPuFcnqu,#因父去世请假8天未获批强行休假被辞#希望保障员工权益的制度越来越健全 ,,,,,2021-01-25,Android,0,5,0,因父去世请假8天未获批强行休假被辞,
4596899351631647,JEENh6QsT,不知道怎么写，知道消息跑到主页截图去确认，结果真的是你，确认那一刻，眼泪刷刷的流，920后一起奋斗到凌晨几点的控评前排都能看到你，几乎活跃在毅哥需要力量的每一个地方哥的果篮里少了一颗果子，这世界上少了一个那么爱毅哥的人@vivi淇淇淇淇淇子 你放心，我们会带着你对哥的爱加倍，和你在不同的空间一起陪着哥哥走下去,,,,,2021-01-24,Android,10,13,0,,vivi淇淇淇淇淇子
4596258880357120,JEo8g1uU0,成毅空降淘。宝olay直播间马上来了，奇异果向淘，宝冲啊 ,,https://wx2.sinaimg.cn/large/de84360cgy1gmwq4w1mt2j20u01t07wh.jpg,,,2021-01-22,Android,2,0,0,,
4596210567223964,JEmSkujhy,#傅云深又苏又虐#我又要被从头虐到尾了跟着成毅大淇淇一起哭(´;︵;`)他哭我也哭(´;︵;`)共情能力真牛 ,,"https://wx3.sinaimg.cn/large/de84360cgy1gmwkk1z7g6g20qo0f0npj.gif,https://wx3.sinaimg.cn/large/de84360cgy1gmwkk3m1u8g20p10aqkjo.gif,https://wx3.sinaimg.cn/large/de84360cgy1gmwkk4tp3ej20sg1ekttz.jpg",,,2021-01-22,Android,3,2,0,傅云深又苏又虐,
4595963484968897,JEgrOkQDv,#成毅南风知我意#过年要买大白兔奶糖 ,,,,,2021-01-22,Android,2,4,0,成毅南风知我意,
4595407751223176,JE1Zt58cE,#美国德特里克堡生物实验室#世界欠武汉一个道歉 ,,,,,2021-01-20,Android,2,0,0,美国德特里克堡生物实验室,
4595202884370770,JDWF2il2i,#外交部#我大武汉需要一个真相 深圳 ,,,,深圳,2021-01-19,Android,1,2,0,外交部,
