id,bid,正文,头条文章url,原始图片url,视频url,位置,日期,工具,点赞数,评论数,转发数,话题,@用户
4595143950484107,JDV7Z21Wb,成毅粉丝每5个里面就有一个男的好厉害，代言方面可以扩宽一下路线了 深圳 手上有颗水晶球的微博视频 ,,,"https://f.video.weibocdn.com/002a27j9gx07JHf1RYXC010412005Daz0E010.mp4?label=mp4_720p&template=720x1072.24.0&trans_finger=c3f00996be5378650057cf237d7bfffd&ori=0&ps=1CwnkDw1GXwCQx&Expires=1620491592&ssig=bjuNH3fZfE&KID=unistore,video",深圳,2021-01-19,Android,7,1,0,,
4594857970512220,JDNGJ29fC,决定为了成毅，再去刷琉璃，给琉璃贡献热度，司凤就是成毅的心血啊(╥ω╥`) 手上有颗水晶球的微博视频 ,,,"https://f.video.weibocdn.com/0007jW4mgx07JFYZ4gzd010412011Jgj0E010.mp4?label=mp4_720p&template=720x1280.24.0&trans_finger=c3f00996be5378650057cf237d7bfffd&ori=0&ps=1CwnkDw1GXwCQx&Expires=1620491592&ssig=DufmaSWl0P&KID=unistore,video",,2021-01-18,Android,4,4,0,,
4594718904156538,JDK4qhriW,#成毅新戏轮椅造型#成毅南风知我意 ,,"https://wx1.sinaimg.cn/large/de84360cgy1gmrt9wdouaj20u014htg6.jpg,https://wx1.sinaimg.cn/large/de84360cgy1gmrt9yk19aj22p81sve81.jpg,https://wx3.sinaimg.cn/large/de84360cgy1gmrta02zt6j22p81svhdu.jpg,https://wx4.sinaimg.cn/large/de84360cgy1gmrta1knc0j22p81svhdu.jpg,https://wx4.sinaimg.cn/large/de84360cgy1gmrta38qwcj22p81svqv6.jpg",,,2021-01-18,Android,2,1,0,成毅新戏轮椅造型,
4594474015532147,JDDHrndab,晴雅集来说，郭导这电影一个选角一个人物设定成了点睛之笔，金灵子扮演者和剧里人物鹤守月  （金灵子开始出场连奔跑的背影都好好看）手上有颗水晶球的微博视频 深圳 ,,,"https://f.video.weibocdn.com/002MForRgx07JEif96qj01041200tLbl0E010.mp4?label=mp4_720p&template=720x1280.24.0&trans_finger=c3f00996be5378650057cf237d7bfffd&ori=0&ps=1CwnkDw1GXwCQx&Expires=1620491606&ssig=fWZeVX7Q7V&KID=unistore,video",深圳,2021-01-17,Android,20,0,2,,
4594316967674162,JDzC8wcoO,#成毅张予曦奶糖吻#成毅南风知我意路透好绝一男子，我已经留下了鼻血 ,,"https://wx4.sinaimg.cn/large/de84360cgy1gmqj42tlt2j20u014hdnb.jpg,https://wx4.sinaimg.cn/large/de84360cgy1gmqj43pzr5j20u0190792.jpg,https://wx2.sinaimg.cn/large/de84360cgy1gmqj45ldiej20u019078m.jpg,https://wx4.sinaimg.cn/large/de84360cgy1gmqj465e4gj20u019041x.jpg,https://wx1.sinaimg.cn/large/de84360cgy1gmqj4hzgcwg20f00qox6w.gif,https://wx1.sinaimg.cn/large/de84360cgy1gmqj4iuiu3j20u01ha0vp.jpg,https://wx3.sinaimg.cn/large/de84360cgy1gmqj4jbkpmj20u00txmyq.jpg,https://wx4.sinaimg.cn/large/de84360cgy1gmqj4kc7bij20u0190n1w.jpg,https://wx2.sinaimg.cn/large/de84360cgy1gmqj4kwf6rj20hs0hswfk.jpg",,,2021-01-17,Android,24,3,0,成毅张予曦奶糖吻,
4594106958882189,JDu9pBgF7,#追光吧哥哥# MIC肖顺尧冲啊！我在优酷截取了一段小视频 招財进寶06219的优酷视频 @优酷 ,,,https://api.youku.com/videos/player/file?data=WcEl5oUuQdTJOamN4TXpNeU1BPT18MHwxfDEwMDUwfDAO0O0O,,2021-01-16,Android,1,0,0,追光吧哥哥,优酷
4593341960554379,JDafy2kdB,#郑爽 攻击我反弹#希望郑爽未来一年能吃胖点，小仙女要好好滴(｢･ω･)｢嘿 深圳 ,,https://wx1.sinaimg.cn/large/de84360cly1gmnf4ksa4vj20qn17udim.jpg,,深圳,2021-01-14,Android,32,1,0,郑爽 攻击我反弹,
4591913326615499,JCz5irKZB,成毅CY#成毅萧承煦# CY#成毅禹司凤# 在爱成毅的基础上求同存异，因为爱我所爱，我亦爱你 深圳 ,,https://wx1.sinaimg.cn/large/de84360cgy1gmiv1cmmsxj21d921w1ky.jpg,,深圳,2021-01-10,Android,4,10,0,"成毅萧承煦,成毅禹司凤",
4591154778345939,JCflPz19V,电视剧琉璃守护琉璃，守护司凤，做个勇敢正直的守琉弹  @成毅 ,,,,,2021-01-08,电视剧琉璃超话,18,1,0,,成毅
4590466601849612,JBXrS7Las,成毅前几年和现在也没多久，但足够饱经风霜长大成人 手上有颗水晶球的微博视频 ,,,"https://f.video.weibocdn.com/000PXa5bgx07JmEDTYmr010412002LQh0E010.mp4?label=mp4_ld&template=360x780.24.0&trans_finger=81b11b8c5ffb62d33ceb3244bdd17e7b&ori=0&ps=1CwnkDw1GXwCQx&Expires=1620491659&ssig=jw0MWWPkD2&KID=unistore,video",,2021-01-06,Android,4,4,0,,
4590166628369675,JBPE2z7kL,我的阳光信用730分已经多年，现在居然涨了6分，看来粉成毅长信用分成毅满满的正能量 深圳 ,,https://wx2.sinaimg.cn/large/de84360cgy1gmdaf3detdj20u01r3qe3.jpg,,深圳,2021-01-06,Android,12,12,0,,
4590156122168848,JBPn696dq,用自己觉得最舒服的姿态来支持成毅，奇异果们共勉之，不焦虑、不暴躁、不偏激（水至清则无鱼，不要过分追求“极”）、不以己物喜不以己悲（我们尽全力做好粉丝范围内的事情，其他的都交给淇淇，或得或失感太重不可能快乐追星），淇淇是个演员，演员的路像河里流水，大部分的日常都是静静匀速的流动。 深圳,,,,深圳,2021-01-05,Android,83,11,0,,
4589981336600834,JBKPbrHb4,成毅好可爱的成毅 手上有颗水晶球的微博视频 ,,,"https://f.video.weibocdn.com/003wk8Ddgx07Jkwdu9wb010412005JEP0E010.mp4?label=mp4_720p&template=720x1280.24.0&trans_finger=c3f00996be5378650057cf237d7bfffd&ori=0&ps=1CwnkDw1GXwCQx&Expires=1620491673&ssig=xRLdHQ0hfz&KID=unistore,video",,2021-01-05,Android,7,0,0,,
4589390360217582,JBvs00UBo,成毅是一个值得陪伴的成长系艺人，就像我看了三十多遍现在还依然看的知否知否应是绿肥红瘦里赵丽颖演的一个成长系女主，没有几个有那个本事出道既顶流，看琉璃时发现了这块璞玉，那会儿我以为他才20多岁，因为真的太青春气息，越考古越爱他，原来他已经在自己的行业里兢兢业业多年，我喜欢这样爱一个东西始终如一而且热情饱满的人，积极向上，成毅喜欢喝茶、钓鱼，身边喜欢这样在工作之余慢节奏生活的人，都是不爱表达但饱含智慧会思考，成毅对工作的热爱钟情加自己的智慧，我相信他会越来越好，我会一直陪着这样的他，笔芯。 深圳,,,,深圳,2021-01-03,Android,140,15,1,,
4589385762216341,JBvkA9izr,取关了几个WYB粉丝，也关了我的来互取关一下，还有是他粉丝的来一波互取关，不是顶流粉多看顶流吴博一眼都赔不起 ,,,,,2021-01-03,Android,10,0,0,,
4589320693088340,JBtDDcXpW,说了多少次了成毅粉丝不要去点某人相关，你们天天浏览一个艺人后台数据会抓取为同属性，只要同属性里今天有不少人也点了搜了某人，立马后台就会给其他同等属性的人推荐此相关，我刚上线广场搜的看成毅资讯，全里面顺延给我推荐了不想看到的倒T货资讯，好么原来你们又被J人撩拨去给贡献热度了 ,,,,,2021-01-03,HUAWEI Mate 20 Pro,0,3,0,,
4589080283712060,JBnnSfzFW,哈哈这个点我还钻在网易云里听成毅的歌，几首循环播放 深圳 ,,https://wx4.sinaimg.cn/large/de84360cgy1gm9tnwcga0j20u01t0wnu.jpg,,深圳,2021-01-03,HUAWEI Mate 20 Pro,5,1,0,,
4589047265373342,JBmwCmxQO,我现在无聊开始看成毅的长安诺还怪好看的而且成毅在剧里演技很不错，就是很虐π_π我的天我的九啊！为什么在9月份以至于到今天前都觉得它不好看，都不想点开我是不之前吃了啥此剧不好看的洗脑包了 深圳 ,,,,深圳,2021-01-02,HUAWEI Mate 20 Pro,63,47,0,,
4588915484272538,JBj64hVtU,#成毅南风知我意#cy#成毅梦醒长安# 剪辑不易希望大家喜欢成毅，背景音乐是成毅浙江卫视跨年唱的六月的雨 手上有颗水晶球的微博视频 ,,,"https://f.video.weibocdn.com/003YCI5cgx07JfPkDXX101041200lm9j0E010.mp4?label=mp4_720p&template=720x1280.24.0&trans_finger=c3f00996be5378650057cf237d7bfffd&ori=0&ps=1CwnkDw1GXwCQx&Expires=1620491681&ssig=U5%2FdEyJ4Oi&KID=unistore,video",,2021-01-02,微博视频号,3,3,1,"成毅南风知我意,成毅梦醒长安",
4588694977384348,JBdmpuZ0o,在新的一年，奇异果和成毅一起加油 深圳 手上有颗水晶球的微博视频 ,,,"https://f.video.weibocdn.com/003kLgjwgx07JeRbOhvq010412004IW50E010.mp4?label=mp4_720p&template=720x1080.24.0&trans_finger=c3f00996be5378650057cf237d7bfffd&ori=0&ps=1CwnkDw1GXwCQx&Expires=1620491681&ssig=cwG3JzCyl%2B&KID=unistore,video",深圳,2021-01-01,微博视频号,5,6,1,,
4588474722420070,JB7Daa9zo,今天是我的生日01月01日，来祝福我吧~ ,,,,,2021-01-01,生日动态,2,8,0,,
4588336351812247,JB41Z7BrN,虽然很遗憾站错了门口（大部分果子选错了门口），没有看到你，但是听到了你唱歌就圆满了，今天请了半天假站了8个小时很累，咱们后会有期，成毅加油 深圳·深圳华侨城 ,,,,深圳·深圳华侨城,2020-12-31,HUAWEI Mate 20 Pro,167,23,0,,
4588297916259582,JB31Zqgp0,#成毅刺绣中国风西装造型#成毅太好看了吧 深圳·深圳大学南校区 ,,"https://wx3.sinaimg.cn/large/de84360cgy1gm7bududywj218z0u0mzj.jpg,https://wx2.sinaimg.cn/large/de84360cgy1gm7buf3d0jj218z0u0q5x.jpg,https://wx2.sinaimg.cn/large/de84360cgy1gm7bug157xj20u0149wi8.jpg,https://wx4.sinaimg.cn/large/de84360cgy1gm7bugm4noj20u018zjuz.jpg,https://wx3.sinaimg.cn/large/de84360cgy1gm7buhd3n6j218z0u0dir.jpg,https://wx4.sinaimg.cn/large/de84360cgy1gm7buiaxdbj218z0u0diq.jpg,https://wx1.sinaimg.cn/large/de84360cgy1gm7buiu5w4j218z0u0ju9.jpg,https://wx1.sinaimg.cn/large/de84360cgy1gm7bujbpipj218z0u041o.jpg,https://wx3.sinaimg.cn/large/de84360cgy1gm7bujyq69j20qo11utdl.jpg",,深圳·深圳大学南校区,2020-12-31,HUAWEI Mate 20 Pro,2,0,0,成毅刺绣中国风西装造型,
4588297375198111,JB317lOgv,哈哈我在体育馆外听完了成毅唱的情人咒，哈哈 深圳·深圳大学南校区 ,,,,深圳·深圳大学南校区,2020-12-31,HUAWEI Mate 20 Pro,44,12,0,,
4588228630546736,JB1ef2iek,我到了(*^▽^)/★*☆哈哈成毅加油 深圳·深圳湾体育中心 ,,https://wx3.sinaimg.cn/large/de84360cgy1gm73w23hqdj21400u0gqc.jpg,,深圳·深圳湾体育中心,2020-12-31,HUAWEI Mate 20 Pro,20,2,0,,
4587215127060999,JAARytCT5,#成毅送爸妈怡养好骨劲#跟着成毅一起买雀巢怡养奶粉，给爸妈和家里长辈新年最好的骨劲 深圳 ,,"https://wx2.sinaimg.cn/large/de84360cgy1gm3vgsi5uyj20sg0sgmyu.jpg,https://wx2.sinaimg.cn/large/de84360cgy1gm3vgsr3suj20u00u00ua.jpg,https://wx2.sinaimg.cn/large/de84360cgy1gm3vgt1m6lj20rn0rntay.jpg,https://wx4.sinaimg.cn/large/de84360cgy1gm3vgtle55j20u017galc.jpg,https://wx1.sinaimg.cn/large/de84360cgy1gm3vgu8i2pj20u017vq97.jpg,https://wx4.sinaimg.cn/large/de84360cgy1gm3vgv6hq6j20u0190gul.jpg",,深圳,2020-12-28,HUAWEI Mate 20 Pro,3,0,0,成毅送爸妈怡养好骨劲,
4587065088679450,JAwXyApV8,#追光吧哥哥节目组道歉#真的是因为从第一集郑爽的直言敢说这个节目才吸引目光，但是这次剪辑太剑走偏锋突出敢说这个点了，事先应该沟通一下为好，避免带来一些困扰，还是希望郑爽继续参加，我喜欢她在节目里说的话，综艺真人秀搞那么多客套话还怎么真人秀，粉丝要接受自己喜欢的艺人魔鬼蜕变过程中的批评，希望节目组好好对待自己的嘉宾,,,,,2020-12-28,HUAWEI Mate 20 Pro,4,5,0,追光吧哥哥节目组道歉,
4586917226876345,JAt74sQQN,给自己蒸煮带被人防爆的高帽子，是不知耻还是自己比蒸煮头还大？一个自己天天发通稿已经进了顶流⭕️，一个天天粉丝到处拉踩造谣蒸煮被同事防爆、虐粉（请问你蒸煮配吗？），所以这俩真特么绝配，猪连碧涸 ,,,,,2020-12-28,HUAWEI Mate 20 Pro,1,2,0,,
4586876432288897,JAs3h9BrH,#电视剧大赏#我已为@成毅  投出一票，和我一起选出2020年人气男性角色吧～人气男性角色 ,,,,,2020-12-27,势力榜,0,1,0,电视剧大赏,成毅
4586135526054265,JA8MgpoZr,晴雅集，值票价，词句写的有些不太好，希望以后多多反复推敲一下，男三很出彩，公主和守护者的爱情很美，王子文演的共情能力很棒，邓伦变身很妖孽（太美啦），赵又廷属于入股不亏的选手（接的剧不要担心不好滴），下面夸夸郭敬明导演，我以前没看过郭导的书也没看过他的电影，这是第一部，作为编剧当导演最牛逼之处是里面的场景超级炫酷，这完全就是大编写书脑海里才能构架出来的，一般拍出来的效果会大打折扣，但晴雅集郭导把自己脑子里的大场景（无数个帅酷）都拍了出来，郭导应该是一个追求完美极致之人，电影画面也很美，希望晴雅集票房大卖,,,,,2020-12-25,HUAWEI Mate 20 Pro,2,0,0,,
4586009573984876,JA5v7gIEc,#浙江卫视跨年#成毅啊@新浪圈子 深圳 ,,https://wx3.sinaimg.cn/large/de84360cgy1gm0112k4ztj20f30hgjrt.jpg,,深圳,2020-12-25,HUAWEI Mate 20 Pro,0,1,0,浙江卫视跨年,新浪圈子
4586009200951668,JA5uw3Zzu,#浙江卫视跨年#你最想和谁倒数新年？  #浙江卫视跨年#你最想和谁倒数新年？ ,,,,,2020-12-25,新浪新闻客户端,0,0,0,浙江卫视跨年,
4585744212952124,JzYB7cnYU,成毅在深圳跨年晚会需要应援的我可以去帮忙，我在深圳，提前和我说一声，我把工作安排一下 深圳 ,,,,深圳,2020-12-24,HUAWEI Mate 20 Pro,21,19,1,,
4585618346095624,JzVk6pzKw,@成毅 我在2021#微博跨年狂欢节#惊喜榜为你送惊喜啦！今年跨晚就看你了！冲鸭！ 跨年明星惊喜榜 ,,,,,2020-12-24,HUAWEI Mate 20 Pro,0,0,0,微博跨年狂欢节,成毅
4585376247456017,JzP1CvhEl,#迪丽热巴 黄景瑜#蹭蹭为一个人，记住一个夏天@成毅 ,,"https://wx2.sinaimg.cn/large/de84360cgy1gly09kk67nj20b50dwdod.jpg,https://wx4.sinaimg.cn/large/de84360cgy1gly09ka7jrj20go0gowfp.jpg,https://wx2.sinaimg.cn/large/de84360cgy1gly0apri2aj20u01lfdow.jpg",,,2020-12-23,HUAWEI Mate 20 Pro,7,1,0,迪丽热巴 黄景瑜,成毅
4585370831816417,JzOST7Cx3,#迪丽热巴 黄景瑜#巴巴加油，我来安利成毅咯！ ,,https://wx2.sinaimg.cn/large/de84360cgy1glxznqix8lj20u01aotc9.jpg,,,2020-12-23,HUAWEI Mate 20 Pro,21,4,0,迪丽热巴 黄景瑜,
4585368605691937,JzOPinSJr,#迪丽热巴 黄景瑜#巴巴加油，我来安利成毅了，十年演绎历练，希望成毅越来越好，果果和淇淇（成毅小名）一起加油 ,,"https://wx2.sinaimg.cn/large/de84360cgy1glxzcb134vg20hj0tn7ww.gif,https://wx3.sinaimg.cn/large/de84360cgy1glxzcwxgdzg20k00b9u13.gif,https://wx1.sinaimg.cn/large/de84360cgy1glxzcyaqanj20k00zk16u.jpg,https://wx2.sinaimg.cn/large/de84360cgy1glxzcz4mkaj20u0190dnz.jpg,https://wx3.sinaimg.cn/large/de84360cgy1glxzcx8r7bj20go0gowfp.jpg,https://wx4.sinaimg.cn/large/de84360cgy1glxzd1xge9j20u01hctkc.jpg,https://wx2.sinaimg.cn/large/de84360cgy1glxzd2lrhvj20b50dwdod.jpg,https://wx4.sinaimg.cn/large/de84360cgy1glxzd3f0evj20u00u0gts.jpg,https://wx4.sinaimg.cn/large/de84360cgy1glxzd52sf6j20rp1doh2q.jpg,https://wx1.sinaimg.cn/large/de84360cgy1glxzd6sn10j20u018019z.jpg,https://wx3.sinaimg.cn/large/de84360cgy1glxzd7ps1ej20u01lfdow.jpg,https://wx2.sinaimg.cn/large/de84360cgy1glxzd82y3pj20e70e774h.jpg,https://wx3.sinaimg.cn/large/de84360cgy1glxzd8d9s5j20u01aotc9.jpg,https://wx1.sinaimg.cn/large/de84360cgy1glxzd8qhpqj20u01hdafj.jpg,https://wx1.sinaimg.cn/large/de84360cgy1glxzd982fej20u0190gqd.jpg,https://wx2.sinaimg.cn/large/de84360cgy1glxze7q4xpg20ku0m01l8.gif,https://wx4.sinaimg.cn/large/de84360cgy1glxze8prnpj20go0nmafe.jpg,https://wx1.sinaimg.cn/large/de84360cgy1glxzf6rnv0g20ku0etqvf.gif",,,2020-12-23,HUAWEI Mate 20 Pro,16,14,0,迪丽热巴 黄景瑜,
4585359235358261,JzOAbmtVz,#谢娜#有人在搞湖南卫视，鉴定完毕 ,,,,,2020-12-23,HUAWEI Mate 20 Pro,4,2,0,谢娜,
4585046529029046,JzGrOBSRM,成毅突然发现王者荣耀新英雄澜的侧脸好像成毅耶 ,,https://wx1.sinaimg.cn/large/de84360cgy1glwye7blrhj20qo0eldh8.jpg,,,2020-12-22,HUAWEI Mate 20 Pro,3,2,0,,
4585032746806445,JzG5AsyFn,#琉璃netflix播出#2020年夏天最美的记忆---琉璃禹司凤 手上有颗水晶球的微博视频 ,,,"https://f.video.weibocdn.com/000hGSdtgx07IYJPdIvl010412008AEC0E010.mp4?label=mp4_720p&template=720x1264.24.0&trans_finger=c3f00996be5378650057cf237d7bfffd&ori=0&ps=1CwnkDw1GXwCQx&Expires=1620491713&ssig=iztAquNjmi&KID=unistore,video",,2020-12-22,微博视频号,22,0,0,琉璃netflix播出,
4585032637222773,JzG5puiYl,#琉璃netflix播出#这个夏天感谢琉璃，感谢尹涛导演的作品，感谢琉璃的服装、头套、配饰、道具组的所有人的付出，让这个电视剧惊艳了我整个夏天，也感谢让我认识这个努力的演员成毅 ,,"https://wx1.sinaimg.cn/large/de84360cgy1glwwli6ykdg20ku0m01l8.gif,https://wx3.sinaimg.cn/large/de84360cgy1glwwu3zwpzj20u01hcdnc.jpg,https://wx1.sinaimg.cn/large/de84360cgy1glwwo0hiebg20p70mfhej.gif,https://wx3.sinaimg.cn/large/de84360cgy1glwwu1if5tj20u01hctkc.jpg,https://wx3.sinaimg.cn/large/de84360cgy1glwwu2mbphj20u01aotc9.jpg,https://wx1.sinaimg.cn/large/de84360cgy1glwwphgdt8g21c00r0npu.gif,https://wx4.sinaimg.cn/large/de84360cgy1glwwqlgj6qg20o60ehhe3.gif,https://wx1.sinaimg.cn/large/de84360cgy1glwwqmz9njj20u016gtog.jpg,https://wx4.sinaimg.cn/large/de84360cgy1glwwqza07ug20qo0f07wk.gif,https://wx2.sinaimg.cn/large/de84360cgy1glwwsfbij4g20q50epkk1.gif,https://wx4.sinaimg.cn/large/de84360cgy1glwwu0imrkg20n80jge8j.gif,https://wx4.sinaimg.cn/large/de84360cgy1glwwu27i04j21d10u0456.jpg,https://wx1.sinaimg.cn/large/de84360cgy1glwwu37pl1j20go0nmafe.jpg",,,2020-12-22,HUAWEI Mate 20 Pro,75,4,0,琉璃netflix播出,
4584643607140352,JzvXWtXwY,雀巢怡养奶粉新代言人成毅，@雀巢怡养 官方做了好多功课耶，17点17分掐点官宣 ,,https://wx2.sinaimg.cn/large/de84360cgy1glvo5g9zm2j20u01qr1fv.jpg,,,2020-12-21,HUAWEI Mate 20 Pro,10,0,0,,雀巢怡养
4584633511445817,JzvHF647D,#成毅雀巢怡养代言人#这个久坐办公室的不论男女老少都可以喝，我经常不活动膝盖也有点痛，这个正合适，而且快过年了正好买给爸妈新年礼物 ,,,,,2020-12-21,HUAWEI Mate 20 Pro,3,0,0,成毅雀巢怡养代言人,
4584543728960492,JztmQBB24,#欧盟多国紧急限制英国人员往来#英国真的开始实行全民免疫了？ ,,,,,2020-12-21,HUAWEI Mate 20 Pro,0,2,0,欧盟多国紧急限制英国人员往来,
4584385770164726,Jzpg50GQS,第N遍知否又一遍新的启程，正午多会儿再来一部成长系古代剧啊@正午阳光影业 ，从首映的第一遍开始，我刷到了现在，记得第一年过年回家还和姐姐一起反复讨论剧情，现在马上又要过年了#知否知否应是绿肥红瘦# ,,,,,2020-12-21,HUAWEI Mate 20 Pro,2,1,0,知否知否应是绿肥红瘦,正午阳光影业
4583548365317547,Jz3tqmjkT,#电视剧大赏#我已为@谭松韵seven  投出一票，和我一起选出2020年人气女性角色吧～人气女性角色 ,,,,,2020-12-18,势力榜,0,0,0,电视剧大赏,谭松韵seven
4583548335949160,Jz3tnoXEc,#电视剧大赏#我已为@电视剧琉璃  投出一票，和我一起选出2020年人气电视剧吧～人气剧集 ,,,,,2020-12-18,势力榜,0,0,0,电视剧大赏,电视剧琉璃
4583548290343689,Jz3tj1rpn,#电视剧大赏#我已为@成毅  投出一票，和我一起选出2020年人气男性角色吧～人气男性角色 ,,,,,2020-12-18,势力榜,0,1,0,电视剧大赏,成毅
4583253699202799,JyVO9CC4f,成毅成毅好帅哟 手上有颗水晶球的微博视频 ,,,"https://f.video.weibocdn.com/000CM9LJgx07IQUlaNtJ010412002xnU0E010.mp4?label=mp4_ld&template=360x800.24.0&trans_finger=81b11b8c5ffb62d33ceb3244bdd17e7b&ori=0&ps=1CwnkDw1GXwCQx&Expires=1620491732&ssig=Q7T3tRhxvn&KID=unistore,video",,2020-12-17,微博视频号,1,0,0,,
4583209667660917,JyUF8w8Xb,又一遍知否知否看完了 ,,https://wx3.sinaimg.cn/large/de84360cgy1glr3gt36wcj21t00u0e59.jpg,,,2020-12-17,HUAWEI Mate 20 Pro,0,0,0,,
4583160031216798,JyTn556xM,果子成毅直播间时候买了olay，还送了很多小样怕用不完的，正好现在冬天天气干燥拿来当护手霜，小小的放包包里不占地方，我用了几天，超级好用，而且很耐用，比我每年冬天买的贵的护手霜都好用，给我省钱了 ,,https://wx2.sinaimg.cn/large/de84360cgy1glqxltpwb8j22402tchdu.jpg,,,2020-12-17,HUAWEI Mate 20 Pro,20,2,0,,
4583120797958202,JySlNxoi6,#成毅清新橙意大片#嘻嘻(♡˙︶˙♡买咯 ,,https://wx3.sinaimg.cn/large/de84360cgy1glqt9drrzdj20u00oowph.jpg,,,2020-12-17,HUAWEI Mate 20 Pro,1,1,0,成毅清新橙意大片,
4583114423148717,JySbwdd7L,成毅来来来，晒单单，哈哈，左边是我今天抢到的，右边是我这个礼拜收到的时尚健康里面的海报（我在海报后面）今天双倍快乐是成毅小宝贝给的，嘻嘻(♡˙︶˙♡) ,,"https://wx3.sinaimg.cn/large/de84360cgy1glqsfvuegyj20u00oojv1.jpg,https://wx3.sinaimg.cn/large/de84360cgy1glqsg52t9bj20k00zk16u.jpg",,,2020-12-17,HUAWEI Mate 20 Pro,7,1,0,,
4583097004467824,JyRJqiKhG,没抢到成毅杂志的等12点30再进去抢，有黑子在卡单，但是半个小时后就会未付款被系统弹出来 ,,,,,2020-12-17,HUAWEI Mate 20 Pro,12,14,0,,
4583094361532335,JyRFa6qD5,谁他妈在卡单？哪里来的这么没有素质的操作 ,,,,,2020-12-17,HUAWEI Mate 20 Pro,0,5,0,,
4582560937545074,JyDMNvEOK,夜晚云上的天空可真美，我一定没当过神仙，恐高啊！ 手上有颗水晶球的微博视频 ,,,"https://f.video.weibocdn.com/000dcLDTgx07INRiLLlB010412006dXx0E010.mp4?label=mp4_720p&template=1280x720.25.0&trans_finger=1f0da16358befad33323e3a1b7f95fc9&ori=0&ps=1CwnkDw1GXwCQx&Expires=1620491734&ssig=YOv0lxMU27&KID=unistore,video",,2020-12-16,微博视频号,0,0,0,,
4582386044766601,JyzeIk00F,#金骨朵网络影视盛典# 年度女演员评选正在打榜中，快一起pick你喜欢的年度女演员第五届金骨朵网络影视盛典评选 ,,,,,2020-12-15,台网话题,0,0,0,金骨朵网络影视盛典,
4582385994177035,JyzeDhwDx,#金骨朵网络影视盛典# 年度男演员评选正在打榜中，快一起pick你喜欢的男演员第五届金骨朵网络影视盛典评选 ,,,,,2020-12-15,台网话题,0,0,0,金骨朵网络影视盛典,
4582385956168330,JyzezpSFc,#金骨朵网络影视盛典# 年度网络剧评选正在打榜中，快一起pick你喜欢的年度网络剧第五届金骨朵网络影视盛典评选 ,,,,,2020-12-15,台网话题,0,0,0,金骨朵网络影视盛典,
4582385913446473,JyzevesAh,#电视剧大赏#我已为@成毅  投出一票，和我一起选出2020年人气男性角色吧～人气男性角色 ,,,,,2020-12-15,势力榜,0,0,0,电视剧大赏,成毅
4582385885121322,JyzesluhY,#电视剧大赏#我已为@电视剧琉璃  投出一票，和我一起选出2020年人气电视剧吧～人气剧集 ,,,,,2020-12-15,势力榜,0,0,0,电视剧大赏,电视剧琉璃
4582385846848858,JyzeosJHs,#电视剧大赏#我已为@谭松韵seven  投出一票，和我一起选出2020年人气女性角色吧～人气女性角色 ,,,,,2020-12-15,势力榜,0,1,0,电视剧大赏,谭松韵seven
4582382885675043,Jyz9CnOkX,成毅成毅的杂志收到了，好激动（我在海报后面），真的杂志拍的好好看，好有质感，值得每一位果果珍藏，我们总监进来让我挂到床头 ,,"https://wx3.sinaimg.cn/large/de84360cgy1glogfhbgkfj20k00zk16u.jpg,https://wx2.sinaimg.cn/large/de84360cgy1glogg6ejobj22402tcqv9.jpg",,,2020-12-15,成毅超话,18,3,1,,
4582128866046097,JysxUpmRH,#电视剧大赏#我已为@谭松韵seven  投出一票，和我一起选出2020年人气女性角色吧～人气女性角色 ,,,,,2020-12-14,势力榜,0,0,0,电视剧大赏,谭松韵seven
4582128815971533,JysxPp3t3,#电视剧大赏#我已为@电视剧琉璃  投出一票，和我一起选出2020年人气电视剧吧～人气剧集 ,,,,,2020-12-14,势力榜,0,0,0,电视剧大赏,电视剧琉璃
4582128777964539,JysxLxpWj,#电视剧大赏#我已为@成毅  投出一票，和我一起选出2020年人气男性角色吧～人气男性角色 ,,,,,2020-12-14,势力榜,0,0,0,电视剧大赏,成毅
4582128728158809,JysxGyetH,#金骨朵网络影视盛典# 年度女演员评选正在打榜中，快一起pick你喜欢的年度女演员第五届金骨朵网络影视盛典评选 ,,,,,2020-12-14,台网话题,0,0,0,金骨朵网络影视盛典,
4582128698531515,JysxDzNr5,#金骨朵网络影视盛典# 年度男演员评选正在打榜中，快一起pick你喜欢的男演员第五届金骨朵网络影视盛典评选 ,,,,,2020-12-14,台网话题,0,0,0,金骨朵网络影视盛典,
4582128655799776,JysxzokMM,#金骨朵网络影视盛典# 年度网络剧评选正在打榜中，快一起pick你喜欢的年度网络剧第五届金骨朵网络影视盛典评选 ,,,,,2020-12-14,台网话题,0,1,0,金骨朵网络影视盛典,
4581781099780469,JyjuZF2lv,啥？现在综艺观众都要求参加综艺的艺人必须完美无缺？请问你们自己做到了吗？不是成毅粉丝的话看你们这样说他，还以为他立了完美人设翻车了，成毅他如何如何用不着谁来担心，他以后上不上综艺也不用你给规划，谁也嘴不死任何一个孜孜不倦努力向上的人 ,,,,,2020-12-13,HUAWEI Mate 20 Pro,82,20,0,,
4581759679205538,JyiWrCCMq,#追光吧哥哥# 陈晓东的情有独钟听别人翻唱很多，第一次听本尊在追光吧哥哥上唱，开口跪，这大双眼皮子好好看(｡･ω･｡)ﾉ♡ 手上有颗水晶球的微博视频 ,,,"https://f.video.weibocdn.com/002cEkfIgx07IKkEdGcM010412005ghP0E010.mp4?label=mp4_720p&template=1280x590.25.0&trans_finger=1f0da16358befad33323e3a1b7f95fc9&ori=0&ps=1CwnkDw1GXwCQx&Expires=1620491739&ssig=t07OyQW%2Bb0&KID=unistore,video",,2020-12-13,微博视频号,6,3,0,追光吧哥哥,
4581500346172826,JyccapTPI,#电视剧大赏#我已为@成毅  投出一票，和我一起选出2020年人气男性角色吧～人气男性角色 ,,,,,2020-12-13,势力榜,0,0,0,电视剧大赏,成毅
4581500282735534,Jycc4btDw,#电视剧大赏#我已为@谭松韵seven  投出一票，和我一起选出2020年人气女性角色吧～人气女性角色 ,,,,,2020-12-13,势力榜,0,0,0,电视剧大赏,谭松韵seven
