id,bid,正文,头条文章url,原始图片url,视频url,位置,日期,工具,点赞数,评论数,转发数,话题,@用户
4634685131195108,KeyjL50TW,#第二只豹子#把那几只比特犬染上豹纹送去动物园得了，我看它们比豹子还凶残！大型猫科动物被几只狗围攻撕咬，毫无还手之力，上次那只东北虎，也没说要放回远离人群的原生态大自然，真的贱！ ,,,,,2021-05-08,iPhone客户端,165,28,2,第二只豹子,
4634639988164463,Kex8WyfWT,#第二只豹子已被狗咬死#有点心疼。从小被关在动物园，失去自由，才出来对世界这么陌生的前提下，突然被咬死。估计小豹子当时吓坏了。没有说狗狗有错，只是单纯觉得对这件事情觉得悲伤 ,,,,,2021-05-08,iPhone客户端,16,1,0,第二只豹子已被狗咬死,
4634121106096931,KejE2pA5B,#爱奇艺道歉#那么多牛奶倒掉真的很心疼。商家也有很大责任，二维码印在瓶盖里，其他人为了瓶盖无法将牛奶送人。平台跟商家真的不做人，两者都盈利了！舆论骂别人追星脑残的时候，请把蒙牛也捎上 ,,,,,2021-05-07,iPhone客户端,9,1,0,爱奇艺道歉,
4633285945463549,KdXV0mVjL,#辰亦儒原来是真瓜主#所以好奇炎亚纶喜欢谁？记得以前爆出来他为哪个明星写小作文表白来着。我觉得只要是真爱没什么可嘲的吧 ,,,,,2021-05-05,iPhone客户端,13,6,0,辰亦儒原来是真瓜主,
4631299585214544,Kd8fclSxy,#情书重映定档#这部电影很适合人一个人静静的去看... 因为也有过去的人需要告别 ,,,,,2021-04-29,iPhone客户端,8,0,0,情书重映定档,
4629874990386822,Kcxbt1CD4,#腾讯被深圳南山法院强制执行#我就知道网友又要骂了 ,,,,,2021-04-25,iPhone客户端,0,0,0,腾讯被深圳南山法院强制执行,
4629621825605150,KcqB8nw9E,#如何看待五一调休凑长假#这是障眼法！对于本来就双休的人来说，上班的时间更多了 ,,,,,2021-04-24,iPhone客户端,0,0,0,如何看待五一调休凑长假,
4628549975672321,KbYIlnND3,#丁真 不怯场#以前听到有人自诩国民闺女国民儿子之类的，我内心是拒绝并想🤮。但如果是丁真，我觉得我可以接受。贫困县旅游大使比营销咖好太多了，好感度upupup ,,,,,2021-04-21,iPhone客户端,49,1,0,丁真 不怯场,
4628330013789175,KbSZzfTJJ,#iPhone12紫色#哪一种紫色吖，竟然有点心动了，其他颜色都care不到。 ,,,,,2021-04-21,iPhone客户端,2,0,0,iPhone12紫色,
4626593776931880,Kb9Pbt5iw,退货还要发在广场上说的是不是弱智。你以为这样做就是爱吗，在品牌商跟哥哥眼里叫幼稚...这个酸奶还拍了hyx的中插广告，给哥哥跟品牌商一点面子吧，就一个酸奶值得咕噜几天几夜吗 ,,,,,2021-04-16,iPhone客户端,0,0,0,,
4626397140615273,Kb4I22A3L,代言国民度蛮高的酸奶品牌，我原以为大家今天都很开心，看来我想错了。你一篇小论文，我一篇小论文，掰扯。白天累死累活的上班狗下了班回到家看这些真的很烦。不会有任何一方出来表态的，写再多也是让自己家粉丝看了烦心！哥哥代言这个产品他是开心的，希望粉丝们不要做让他心烦的事情，过了就过了，不要反复争执。,,,,,2021-04-16,iPhone客户端,0,2,0,,
4625453808092651,KaGawxXgD,#日本政府正式决定福岛核废水排海#大地母亲，我们美丽的地球，真的承受了太多，满目疮痍。其中以印度阿三跟白皮猪鬼子最为突出，一个脏乱差，一个骨子里反人类 ,,,,,2021-04-13,iPhone客户端,1,0,0,日本政府正式决定福岛核废水排海,
4624394984622861,KaeCKjoCh,#阿里巴巴集团被罚182.28亿元#背靠阿里系的营销大户优酷也查一查吧，对，就是那个举报爸爸去哪儿，搞恶意平台竞争的开档贱👖！阴间小人 ,,,,,2021-04-10,iPhone客户端,5,0,0,阿里巴巴集团被罚182.28亿元,
4624337284104417,Kad7GhdKh,@优酷 你就是个贱，希望在破产文书里早日见到你！等着你捧的龅牙心肝湖回锅底 ,,,,,2021-04-10,iPhone客户端,0,0,0,,优酷
4624124917844285,Ka7B9wUEJ,#皓衣行#皓衣行就算不播，也要吸干它的最后一滴血吗，为啥点开是其他剧 ,,,,,2021-04-09,iPhone客户端,12,0,0,皓衣行,
4623835817838804,Ka04RwTek,皓一天不播，就一天死个山贼来殉 ,,,,,2021-04-08,iPhone客户端,0,0,0,,
4623690706982065,K9WiOtilX,#皓衣行#溜啥了从未定档，何来延期一说。播与不播都在瓜主嘴巴里。豆瓣母驴天天骂人现实里过的很不如意吧。黑热搜谁买的啊，会是开档贱👖吗（山贼天天意淫鹅给瀑瀑令买黑热搜，礼尚往来哈） ,,,,,2021-04-08,iPhone客户端,8,1,0,皓衣行,
4623337194785779,K9N6Dk4ZZ,#故宫海棠#一看到海棠花就想起某个师尊海棠花真的好美，很好奇它的香味，这边天气太热了，都没法种植 ,,,,,2021-04-07,iPhone客户端,5,4,0,故宫海棠,
4622387267502203,K9oouvtFh,我为罗云熙贡献288影响力，超话目前在明星超话No.28！还差30.6万影响力超越上一名！戳这里→网页链接 跟我一起助TA荣登超话封面吧~ ,,,,,2021-04-04,超话,0,0,0,,
4622386585147762,K9onolBaq,#皓衣行# 傻逼瓜主们不要为了热度跟引流反复cue皓衣行了，你们随时改口，最后伤的是剧粉的心，还会连累鹅跟皓衣行被骂反炒。其实鹅跟皓衣行从头到尾啥都没说，播与不播都在你们的嘴里。孩子们吃瓜不信瓜，不要相信谁。当然黑子依然会闭眼骂鹅反炒，但我不想看到有剧粉再因为瓜主受伤了。该来的总会来的，不要肆意cue我们皓了,,https://wx1.sinaimg.cn/large/a6b9db6bly1gp82uo4n5fj20j20mpdhf.jpg,,,2021-04-04,iPhone客户端,0,2,0,皓衣行,
4622194434642022,K9jntjtBk,给宇宙最婊的偷偷令山贼上坟 ,,,,,2021-04-04,iPhone客户端,1,0,0,,
4622010523062963,K9eAQcQOD,#罗云熙皓衣行# lyx#罗云熙楚晚宁# 小鹅鹅，会员涨价没事的，只要让我们早日与师尊相见我这颗小韭菜送上门来给求你割@皓衣行官微 @腾讯视频VIP  ,,https://wx1.sinaimg.cn/large/a6b9db6bgy1gp6vnjkajzj206b05naa0.jpg,,,2021-04-03,电视剧皓衣行超话,5,4,0,"罗云熙皓衣行,罗云熙楚晚宁","皓衣行官微,腾讯视频VIP"
4621833016180933,K99YxpVWt,"老鹅,偷偷令的山贼贱粉现在还在皓衣行广场上骂你门买黑热搜，有点骨气好吗，那两个丑东西有种一辈子不要拍鹅平台相关任何资源，拍了就死山贼贱俾@腾讯视频  ",,,,,2021-04-03,iPhone客户端,0,0,0,,腾讯视频
4621665650346345,K95CB1s6d,偷偷令5月份别办什么国风演唱会了，择日不如撞日，清明节办吧，很适合山贼们的风格。朋友圈跟微博有看到发那两个丑货的都直接拉黑了，此生不与丑八怪和解，还有开裆贱👖。晚安 ,,https://wx2.sinaimg.cn/large/a6b9db6bly1gp5s2bdwljj20u00u0n3l.jpg,,,2021-04-02,iPhone客户端,9,0,0,,
4621645460013786,K956203Am,你越是期盼一件事，就失望会越大，结果偏偏会与你所期盼的背道而驰。然后剩下的就是弱小无助迷茫。现实生活里是这样，网络里也是这样。只是想谈一段恋爱而已老天只会给你送渣男，只是想看一部剧而已，最后也一地鸡毛。所以要无欲无求，每天老实打工什么都不期盼，老天爷就开心了吗 ,,,,,2021-04-02,iPhone客户端,0,2,0,,
4620927226876565,K8MpAsQUl,#郑爽诉张恒案终审宣判#还好当时郑爽没有答应张恒，弄那个阴阳合同避税。不然现在她现在可能要蹲大牢，比被封杀还惨！张恒真的太贱了太毒了，男的涉及利益闹分手真的好他妈无情，往死里踩另一半。她代孕纵然千错万错，也是为了你这个狗男人带的孕 ,,,,,2021-03-31,iPhone客户端,18,2,0,郑爽诉张恒案终审宣判,
4620756900907788,K8HYS3O9K,电视剧皓衣行 我已经在发疯的边缘了 ,,,,,2021-03-31,电视剧皓衣行超话,3,0,0,,
4620215478650332,K8tTBAilu,#皓衣行#这就是巨c的魅力吧，一个营销号粉见编料都能引起波澜。海棠花开的正浓，正是我们皓来的好时候，不要随意相信延期谣言，我有预感我们就快要跟师尊相见了♥️ ,,,,,2021-03-29,iPhone客户端,5,2,0,皓衣行,
4620068695312749,K8q4Rmi5v,偷偷令的贱蹄子怎么那么喜欢倒贴hyx跟鹅，要你看了吗，整天在别人广场上喊话倒贴，祖传韩国棒子深入骨髓的贱，贱人不配看hyx，别嚎嚎了，别倒贴了，磕你妈的丑东西不要染指帅哥 ,,,,,2021-03-29,iPhone客户端,1,0,0,,
4618989697239054,K7Y0xuncW,#宋茜ins评论#black pink这几个韩国棒子是阿迪的全球代言，也应该让她们享受下宋茜在ins的同款待遇吧。平时在新浪买热搜买的飞起.....我国明星在外被棒子骂了几十万条，棒子难道不应该享受一下这待遇？别老是狙自己国家艺人了 ,,,,,2021-03-26,iPhone客户端,206,8,0,,
4618909560343387,K7VVi1rkv,#罗云熙皓衣行# lyx#罗云熙楚晚宁# 兔宝们手速太快了吧，礼盒点进去就是下架了独居社宝没有冰箱，这次只能支持一箱了@罗云熙Leo 听说很好吃耶，期待😋 ,,https://wx1.sinaimg.cn/large/a6b9db6bgy1gowzj030x8j20u01hcdp9.jpg,,,2021-03-26,罗云熙超话,4,30,0,"罗云熙皓衣行,罗云熙楚晚宁",罗云熙Leo
4618593725849691,K7NHSoxLR,#匡威#完美避开了辱华的所有品牌，唯独脚上还有一双匡威的鞋子好吧以后也不买了 ,,https://wx2.sinaimg.cn/large/a6b9db6bgy1govz9us1d0j20u00u3jv2.jpg,,,2021-03-25,iPhone客户端,20,8,0,匡威,
4617483438786852,K7kP5ARRq,我为罗云熙贡献220影响力，超话目前在明星超话No.22！还差1.3万影响力超越上一名！戳这里→网页链接 跟我一起助TA荣登超话封面吧~ ,,,,,2021-03-22,超话,0,0,0,,
4617190718836454,K7dcXB4Ls,万万没想到，断腿i岭的虐粉工具人是鹅跟皓衣行。太贱了太贱了太贱了，下图致30的豆瓣贱粉们 ,,https://wx3.sinaimg.cn/large/a6b9db6bly1gori3xkjppj20go0gagn0.jpg,,,2021-03-21,iPhone客户端,4,0,0,,
4616244193921081,K6OAjgs3f,#顾炎沈静雯#这么高的阅读量热搜竟然说没就没！高干子弟了不起啊，想一手遮天。两个狗男女把军装脱了就是现实版嫖客跟🐔，真的侮辱制服。 ,,,,,2021-03-18,iPhone客户端,3,0,0,,
4615855487061343,K6EtmtCYD,依赖型人格又发作了，在家依赖老妈，在他乡依赖老姐，在上班依赖搭档。当她们都不在的时候，毫无所依，竟然想依赖触碰不到的师尊没救了 ,,https://wx4.sinaimg.cn/large/a6b9db6bly1gon8saeyr3j206b05naa0.jpg,,,2021-03-17,iPhone客户端,0,0,0,,
4615662041828201,K6zrm7FB7,#姚安娜跳舞#叫华为投资一部大女主剧给你演吧，比跳舞效果好。跳舞这条道不适合四肢笨拙的人。 ,,https://wx4.sinaimg.cn/large/a6b9db6bgy1gommkmie9aj20ms0msabi.jpg,,,2021-03-17,iPhone客户端,6,2,0,姚安娜跳舞,
4614306833105168,K60bxd1Nm,电视剧皓衣行 皓子只是yxh发了个预播时间还没定档呢，黑子都集体疯了，像失心疯一样集体辱骂攻击演员踩剧。皓衣行啥时候播啊，我想看开播当天黑子当场吓死升天的模样 ,,https://wx3.sinaimg.cn/large/a6b9db6bgy1goiawanp6xj20yi0yle2b.jpg,,,2021-03-13,电视剧皓衣行超话,3,1,0,,
4614275715303652,K5ZnlmfIM,#罗云熙皓衣行# 现在连土豆都不想吃了看到都反胃春天食欲不佳，只有皓衣行开播能缓解 ,,,,,2021-03-13,iPhone客户端,11,5,0,罗云熙皓衣行,
4614052468758205,K5TzgAKpn,#罗云熙# 🦐贱人还管别人跨不过的过去呢，你不开心我们就开心了吖，就是要跨 ,,https://wx2.sinaimg.cn/large/a6b9db6bly1gohhpfopnhg20go09e7tr.gif,,,2021-03-12,iPhone客户端,19,3,0,罗云熙,
4613708729289132,K5KCQCYwI,#皓衣行#他妈酷糊比剧一直辣菜皓衣行快一个月，踩着别人yxh还好意思说勿cue。做人太不要脸小心还没爬上高枝就摔死了。暴发户一样到处辣菜，以前糊疯了所以现在吃相这么难看。吹8.6分赶上奥斯卡断背山了，还捆绑皓干嘛早点忘记你皓爹吧。 ,,,,,2021-03-11,iPhone客户端,1,3,0,皓衣行,
4612978433856916,K5rCXgbmk,#如果你有了一亿存款#做一个无情无义的包租婆，然后把前男友买回来送去非洲挖煤 ,,,,,2021-03-09,iPhone客户端,1,0,0,如果你有了一亿存款,
4612374671132112,K5bV94KvS,我为罗云熙贡献115影响力，超话目前在明星超话No.15！还差3.4万影响力超越上一名！戳这里→网页链接 跟我一起助TA荣登超话封面吧~ ,,,,,2021-03-08,超话,0,0,0,,
4611890271749262,K4ZjR7l3U,果然我首页的仙女们都审美高级，没有看到有发某👖丑货的各个平台都关闭了，安心等皓衣行，只有首页还留有一片净土。天天按头急按头防爆限流，我都替皓子委屈了😭需要看师尊如狼似虎的美色缓缓 ,,https://wx3.sinaimg.cn/large/a6b9db6bgy1goalcji3cvj20k00v5qdi.jpg,,,2021-03-06,iPhone客户端,0,3,0,,
4611066922011774,K4DTS8rlY,#福原爱道歉声明#软饭狗都是没有良心的恶毒胚子！一个江宏杰，一个张恒。富婆真的不适合下嫁，凤凰男不会珍惜的 ,,,,,2021-03-04,iPhone客户端,9,1,0,福原爱道歉声明,
4610451503321189,K4nTgdVZz,皓衣行的广场上怎么一直都有憋婆隔三差五犯贱啊，耽改剧那么多，一部接一部播，王八贱畜永远只看得见皓衣行。你皓爹的存在，就那么让憋婆害怕吗？那么害怕就找个绳子趁早吊死了吧，反正也是一群对社会没有用的现实low货。皓衣行播的时候，估计死憋婆急得当场发鸡瘟 ,,https://wx1.sinaimg.cn/large/a6b9db6bgy1go603skbvdj204i04cq31.jpg,,,2021-03-02,iPhone客户端,0,0,0,,
4609920399573749,K4a4DEazj,电视剧皓衣行 #罗云熙楚晚宁# 皓衣行开播当天大家准备要怎么庆祝吖，现在每一天都度日如年啊 ,,https://wx2.sinaimg.cn/large/a6b9db6bgy1go4b5a5hxsj20s80t80xg.jpg,,,2021-03-01,电视剧皓衣行超话,140,48,0,罗云熙楚晚宁,
4609852838773818,K48jFAOtc,我为罗云熙贡献82影响力，超话目前在明星超话No.18！还差7.8万影响力超越上一名！戳这里→网页链接 跟我一起助TA荣登超话封面吧~ ,,,,,2021-03-01,超话,0,0,0,,
4607797759055371,K3gR1BZIn,真的真的好烦啊，身不由己的感觉。不想离开我的搭档，可是不离开又觉得自己难以坚持了。 ,,https://wx2.sinaimg.cn/large/a6b9db6bgy1gnxjcff8e1j206b05nq34.jpg,,,2021-02-23,iPhone客户端,0,0,0,,
4607508121656263,K39jS6WRV,我为罗云熙贡献167影响力，超话目前在明星超话No.27！还差13万影响力超越上一名！戳这里→网页链接 跟我一起助TA荣登超话封面吧~ ,,,,,2021-02-22,超话,0,0,0,,
4606314506880199,K2EgGsRQX,#对亲戚最无语的一次#找矮丑肥给你相亲，不答应还说你挑剔。对，我就是挑剔怎么了，小仙女不应该挑吗 ,,,,,2021-02-19,iPhone客户端,3,6,0,对亲戚最无语的一次,
4605624769843110,K2mkcFiDQ,#年初六打工人的心声#就是很可怕，需要一直看着我老公的帅脸缓解心情，头痛眼睛痛生无可恋。 ,,https://wx2.sinaimg.cn/large/a6b9db6bgy1gnqlswoaltj20u00k075j.jpg,,,2021-02-17,iPhone客户端,0,0,0,年初六打工人的心声,
4605592473178122,K2lu7dkM2,我前男友好像死了，他想吃富婆软饭这个理想还没完成，还是望他好好活着吧，也可以去跟软饭狗张恒拜师学一下 ,,https://wx1.sinaimg.cn/large/a6b9db6bgy1gnqi35szgbj20j60k20vt.jpg,,,2021-02-17,iPhone客户端,1,0,0,,
4605338068195138,K2eRMynVE,#刘荷娜躺在公公腿上#想到了红楼梦里的“扒灰”，先吐一个吧🤮 ,,,,,2021-02-16,iPhone客户端,0,1,0,刘荷娜躺在公公腿上,
4604900338042202,K23tLxK8W,#陈思诚首位百亿票房导演#只记得他婚内出轨双飞！别在这里尬夸了，出轨还被说有才华，文章李小璐也是有才华的人。沾了王宝强的光，没有王宝强这个电影第一部就扑了夹紧尾巴赚钱就算了，还买热搜想洗白自己🤮 ,,,,,2021-02-15,iPhone客户端,3,0,0,陈思诚首位百亿票房导演,
4602826321832234,K1bwA7GEa,#皓衣行# 好吧，总算看出来一件事，皓衣行过审，死亡八真的急疯了，遇到癫狗咬你，你不能咬癫狗吧，毕竟那么脏。我希望剧粉演员粉都集体闭麦，保持冷静，莫要与颠狗纠缠。 ,,,,,2021-02-09,iPhone客户端,47,11,2,皓衣行,
4601314531614601,K0ycd6M1X,高情商：牺牲自己相亲机会保我院平安。低情商：TMD烦死了，走都走不掉！ ,,https://wx1.sinaimg.cn/large/a6b9db6bgy1gncus8jvydj20n00ke0u3.jpg,,,2021-02-05,iPhone客户端,1,0,0,,
4599697119907968,JFPzNFzvW,我为罗云熙贡献158影响力，超话目前在明星超话No.20！还差9867影响力超越上一名！戳这里→网页链接 跟我一起助TA荣登超话封面吧~ ,,,,,2021-02-01,超话,0,0,0,,
4599540029596474,JFLuqEgtQ,任嘉伦的这条颠狗嘴巴跟吃翔了一样满嘴喷粪，怎么好意思拉黑别人啊，不做人不吃饭，偏要吃屎一直在别人广场上叫，赶都赶不走 ,,https://wx1.sinaimg.cn/large/a6b9db6bgy1gn76zk6cnlj20u01hcdzn.jpg,,,2021-01-31,iPhone客户端,0,0,0,,
4599515018954499,JFKQ5Bztp,#罗云熙厉择良# 广场上任儒艮的狂犬病粉丝怎么还在叫，还有完没完了，膀胱癌尿不尽啊，罗粉明天还要上班呢，丑东西没事干我们很忙啊。 ,,https://wx1.sinaimg.cn/large/a6b9db6bgy1gn743adkjnj20k00k0ta5.jpg,,,2021-01-31,iPhone客户端,0,1,0,罗云熙厉择良,
4599503993441091,JFKyjerbt,#儒艮#突然想买本山海经来看看了，哈哈哈 ,,,,,2021-01-31,iPhone客户端,1,1,0,儒艮,
4599422291544915,JFIqx6tTZ,#驭鲛记##任嘉伦粉丝在线发疯# 就一个心愿，山海经在逃肥鲛人可不可以不要碰瓷可爱的寿星公。垮脸悲伤蛙跟寿星公有壁 ,,https://wx3.sinaimg.cn/large/a6b9db6bgy1gn6tdzmdznj20go0ilwhy.jpg,,,2021-01-31,iPhone客户端,45,7,1,"驭鲛记,任嘉伦粉丝在线发疯",
4599367077463124,JFGZtvjuY,我的微博脏了，娱乐圈在逃肥鲛人任嘉伦的受虐狂贱人粉丝骂神仙哥哥是为哪般 ,,https://wx3.sinaimg.cn/large/a6b9db6bgy1gn6n4g1mazj20go0gogp5.jpg,,,2021-01-31,iPhone客户端,6,0,0,,
4597686009076902,JEZg4C5jE,#程青松出柜#虽然但是，丑男油腻大叔可不可以别搞基，两个大帅哥谈恋爱我尚且还能看，好吧，我真的real颜控 ,,https://wx4.sinaimg.cn/large/a6b9db6bgy1gn1a0xfzs5g208f06kq9c.gif,,,2021-01-26,iPhone客户端,4,0,0,程青松出柜,
4596221945580607,JEnaGnpLN,#霍思燕#她热搜挂了快一整天了干嘛不出来辟谣啊，以前传杜江出轨，杜江半个小时就亲自出来发文辟谣了。发声明说自己没二胎没代孕就完事了啊 ,,,,,2021-01-22,iPhone客户端,24,4,0,霍思燕,
4594695181173889,JDJsa4VnH,#姚安娜单曲#这是生活太顺了来娱乐圈找骂吗，这大白嗓这大脸... ,,,,,2021-01-18,iPhone客户端,34,2,0,姚安娜单曲,
4593314055328616,JD9wxmmdq,#罗云熙被大妈拉着相亲#哈哈哈哈哈哈哈哈哈哈哈哈，又回忆起了我的相亲历史，正在执笔写书中.... ,,,,,2021-01-14,iPhone客户端,2,0,0,罗云熙被大妈拉着相亲,
4592239973502662,JCHA9eHcy,#春节回家#身边认识的同城的同胞都可以回，公寓里住的依然在跨省流动，进进出出的，把我们单位的人留下来不准离深可以起到减少流动保住平安？其他人到处流动，我们单位这几百号人不流动有什么意思呢，留下来独自一人过年的意义是什么呢 ,,https://wx2.sinaimg.cn/large/a6b9db6bgy1gmjwgtlcdoj20j60j5tat.jpg,,,2021-01-11,iPhone客户端,1,0,0,春节回家,
4590477246992370,JBXJ2tl2a,网传女孩为离异家庭，寄住在伯母家 ##快手# @快手 看哭了，我家小侄女跟她一般大，这个孩子太可怜了，希望微博报道这个事件发起一个捐款渠道有好心家庭可以收养 DV现场的快手视频 ,,,http://www.kuaishou.com/rest/kd/partner/weibo/linkcard/video?p=3x6gfsj6gyez54m&a=3xyrfhn878k7cka&f=3xqztnaam2it3vm&kpn=KUAISHOU&subBiz=PHOTO&shareChannel=weibo&shareMethod=card&shareObjectId=41961583237&shareResourceType=PHOTO_OTHER&shareToken=X-7gDovc7E5OHCgF_A,,2021-01-06,iPhone客户端,0,1,0,,快手
4590056587921934,JBMMyxeR8,#当你骗男朋友自己怀孕后#emmm...没有测试过，但我估计前任会立马逃出地球 ,,,,,2021-01-05,iPhone客户端,5,2,0,当你骗男朋友自己怀孕后,
4589952878510942,JBK5hzI5g,#石家庄新增30例本土无症状#反正要在深圳独自过年了，已经没有心情去探究源头了🥺单位发通知不得离深了 ,,,,,2021-01-05,iPhone客户端,3,10,0,石家庄新增30例本土无症状,
4589637086217471,JBBRWq5rN,#拼多多#所以这个社会目前那么多人考公，编制魔怔化，因为资本家私企就是不拿人当人啊，别说机关累了，在机关累死累活跟在私企累死累活结果待遇完全是两码事哈。主打无产阶级的体制内，人民依然被资本主义剥削，不知道哪里出了问题 ,,,,,2021-01-04,iPhone客户端,3,0,0,拼多多,
4587765301248731,JAPaW5eQP,#顶楼19#看这狗血程度，如果吴允熙是男的，我好害怕周丹泰是秀莲儿子这个编剧简直疯人院出来的（此处褒义特指脑洞太大） ,,,,,2020-12-30,iPhone客户端,8,4,0,顶楼19,
4587383510795330,JAFf93kTU,#小伙滑雪身亡雪场该担责吗#两方争执不下，应该让法医尸检明确死亡原因。 ,,,,,2020-12-29,iPhone客户端,0,0,0,小伙滑雪身亡雪场该担责吗,
4586011143182204,JA5xEdlPS,今天这个喜庆的日子，不知道说什么，就给天下的渣男上柱香吧 ,,https://wx1.sinaimg.cn/large/a6b9db6bgy1gm017agzhxg206o06o0sm.gif,,,2020-12-25,iPhone客户端,0,0,0,,
4585369243491204,JzOQkeEdK,今年一定要学会柠檬鸡爪，超级无敌好吃 ,,https://wx1.sinaimg.cn/large/a6b9db6bgy1glxzag509sj21400u0gph.jpg,,,2020-12-23,iPhone客户端,0,0,0,,
4585354130887028,JzOrX3IKU,#吴昕出售粉丝送的HelloKitty水晶#作为公众人物卖粉丝送的礼物，还有人觉得这是正常，有处置权？真的不是凉薄的表现吗，公众人物这么缺钱？捐给贫困山区我还瞧得起她一点。说没地方放的，你明确规定不收不就行了？ ,,,,,2020-12-23,iPhone客户端,1,0,0,吴昕出售粉丝送的HelloKitty水晶,
4585347500215456,JzOhg0U36,#杜海涛#吴昕咸鱼卖了8600多件商品，怎么这位女士神隐了，都是何老师出来说话，没其他意思，单纯问问 ,,,,,2020-12-23,iPhone客户端,12,5,0,杜海涛,
4584329981727704,JznO67fsc,#陈飞宇罗云熙击掌#一起大夏天辛苦拍戏了五个月，关系好很正常！其他圈不相干的杂碎少在别人热搜里骂人，请自重！不友好互动，难道要满脸愁苦相对，黄泉路人别酸了 ,,,,,2020-12-20,iPhone客户端,65,2,0,陈飞宇罗云熙击掌,
4583910955293955,JzcUfmdcn,下班....残阳好美 ,,https://wx3.sinaimg.cn/large/a6b9db6bgy1gltbztcg10j21410u07bg.jpg,,,2020-12-19,iPhone客户端,0,0,0,,
4583904269308438,JzcJsD3y6,#丁真第一次看电影#没想到这么多恶丑男在这个话题里骂丁真，人家确实是第一次看电影啊，同希望祖国贫困地区的孩子们都能看上电影   ,,,,,2020-12-19,iPhone客户端,22,4,0,丁真第一次看电影,
4583770441127673,Jz9fC4Jmh,#2020最遗憾的一件事#从电视台辞职出来，遭受社会的毒打，时光倒流不会再出来了 ,,,,,2020-12-19,iPhone客户端,0,4,0,2020最遗憾的一件事,
4582745181784503,JyIzY7uej,#糖水燕窝曝光者隐私遭辛选泄露#这个什么巴的还有好多孝子给他洗地，这个卖假货的流氓去坐牢的时候，辛有志的孝子们一定要去牢里多看看他 ,,,,,2020-12-16,iPhone客户端,4,0,0,糖水燕窝曝光者隐私遭辛选泄露,
4581856609043333,JylsMBWAd,#大秦赋#熬夜追了剧，怎么说呢，就我认知里焚书坑儒的暴君嬴政不可能为了杀一个太监杀了几十集，这么优柔寡断这么能忍，编剧真的不讲武德乱编。 ,,,,,2020-12-14,iPhone客户端,3,5,0,大秦赋,
4581727713887995,Jyi6TgjrB,符湖笔真的因湖发疯了，多等一天都等不了了，要在公祭日吸血前队友，糊了那么多年怎么一天都等不起了出道n年换了n个组合归来仍是素人，就接受现实吧狗东西 ,,,,,2020-12-13,iPhone客户端,0,0,0,,
4580273864319959,JxGhYi7OL,#专家建议放开三胎#地球少点不食人间烟火的砖家，会更美丽。 ,,,,,2020-12-09,iPhone客户端,2,0,0,专家建议放开三胎,
4579920314114703,Jxx5Jhgqb,#袁湘琴像极了体测的我#如果这次能进面体测，我可能需要我老公云熙哥哥牵着手才能跑完了 ,,,,,2020-12-08,iPhone客户端,2,0,0,袁湘琴像极了体测的我,
4579828135108726,JxuH3lr0O,#郫县豆瓣加油#为什么每次都要用食物来加油啊，一会儿大盘鸡加油，一会儿热干面加油，觉得很鼓舞士气还是什么？不能理解，觉得很诡异🤮豆瓣跟热干面其他城市也有 ,,,,,2020-12-08,iPhone客户端,70,22,0,郫县豆瓣加油,
4579451671155287,JxkTR4QxF,#深圳西丽空气#今天上班太难了，首先在深圳北挤成肉泥，好不容易到西丽下地铁就狂咳嗽，还以为是自己突然感冒了，原来是西丽空气污染 ,,https://wx4.sinaimg.cn/large/a6b9db6bgy1glf3vccwe7j20c80baju4.jpg,,,2020-12-07,iPhone客户端,6,2,0,深圳西丽空气,
4577814751479501,JwEjF6cSV,#什么原因阻碍了你生娃#因为还在观望等待男人可以怀孕生孩子的那一天 ,,,,,2020-12-02,iPhone客户端,7,0,0,什么原因阻碍了你生娃,
4574324255889079,JvbvPoI19,我为罗云熙贡献134影响力，超话目前在明星超话No.48！还差8213影响力超越上一名！戳这里→网页链接 跟我一起助TA荣登超话封面吧~ ,,,,,2020-11-23,超话,0,0,0,,
