id,bid,正文,头条文章url,原始图片url,视频url,位置,日期,工具,点赞数,评论数,转发数,话题,@用户
4634701618748425,KeyKlAHRD,搜救队的狗狗被咬伤的蛮厉害的！他们是为了保护老百姓而且搜救豹子的！ ,,https://wx2.sinaimg.cn/large/60ef5aadly1gqbd72jsufj21jk0plqew.jpg,,,2021-05-08,iPhone客户端,1,0,0,,
4629497556763577,KcnmHsnvX,第一次带他游泳表现很棒 芭比yumi萌萌哒的微博视频 ,,,"https://f.video.weibocdn.com/002RU9e8gx07M8rDKeK3010412016MXT0E010.mp4?label=mp4_720p&template=720x1280.24.0&trans_finger=c3f00996be5378650057cf237d7bfffd&ori=0&ps=1CwnkDw1GXwCQx&Expires=1620511764&ssig=VNVd188WHv&KID=unistore,video",,2021-04-24,iPhone客户端,1,0,0,,
4622554848035671,K9sKMxIrB,我们旁听了郑爽张恒美国庭审，他们都说了什么？ - 最终张恒表示，不同意与郑爽一起抚养孩子...... - 我们旁听了郑爽张恒美国庭审，他们都说了什么？ ,,,,,2021-04-05,iPhone客户端,7,0,1,,
4618192712371181,K7Dh59WQR,五年多的车子开了27000公里.没有什么毛病，就是第六年要验车感觉好麻烦想换车了！ ,,,,,2021-03-24,iPhone客户端,0,0,0,,
4616771586232097,K72iWq9fH,这些才是区属市重点吧，看看自己区里有几个区属市重点就知道能分配几个了，别说比例什么的，比例和考试人数成正比，浦东十一个名额就是菜中全年级前十，1：2名额面试就是20人面试录取十个，以上都是基于达到分控线和50分综评拿满分前提下！ ,,https://wx4.sinaimg.cn/large/60ef5aadly1goq5uk4ozoj20ka0go76i.jpg,,,2021-03-20,iPhone客户端,0,0,0,,
4615791028208432,K6CNoyro4,重磅|十问十答：深度详解2022上海中考改革重磅|十问十答：深度详解2022上海中考改革 ,,,,,2021-03-17,iPhone客户端,0,0,0,,
4612415461789034,K5cYW7vpo,还在等一个通知 ,,https://wx2.sinaimg.cn/large/60ef5aadly1goc9pcev19j20u00u7wiy.jpg,,,2021-03-08,iPhone客户端,0,0,0,,
4604035552774395,K1GYXbDKj,上海寻狗主人！ 芭比yumi萌萌哒的微博视频 ,,,"https://f.video.weibocdn.com/00075Qw5gx07Kknqg619010412002zGY0E010.mp4?label=mp4_ld&template=360x632.24.0&trans_finger=81b11b8c5ffb62d33ceb3244bdd17e7b&ori=0&ps=1CwnkDw1GXwCQx&Expires=1620511765&ssig=KneTBJ%2BHtk&KID=unistore,video",,2021-02-13,iPhone客户端,0,0,0,,
4603554859601774,K1utDEhRk,#李佳琦千万红包犇新年#好运来袭~感谢@人民日报 和@李佳琦Austin 联手送我的暖心拜年红包！快来领走属于你的千万现金红包，一起温暖过大年人民日报 的红包 ,,,,,2021-02-11,粉丝红包,0,0,0,李佳琦千万红包犇新年,"人民日报,李佳琦Austin"
4603182572911113,K1kNbcdjr,新年希望妈妈身体健康，快点搞定大事情，狗子也健健康康，我国动保法快出台！ ,,"https://wx1.sinaimg.cn/large/60ef5aadly1gnit9s2vazj21jk2bce82.jpg,https://wx4.sinaimg.cn/large/60ef5aadly1gnit9skeu3j21jk1rwwv4.jpg,https://wx3.sinaimg.cn/large/60ef5aadly1gnit9tjk7rj21jk2bcb29.jpg",,,2021-02-10,iPhone客户端,0,0,0,,
4602789458096654,K1az7xYjc,和🐶的新年合照，被迫营业的🐶生无可恋的样子 ,,"https://wx3.sinaimg.cn/large/60ef5aadly1gnhk5jysyfj21jk2bcb29.jpg,https://wx3.sinaimg.cn/large/60ef5aadly1gnhk5iht45j22bc1jkqlk.jpg",,,2021-02-09,iPhone客户端,0,0,0,,
4600843842103593,K0lX28PeV,香港居民大陆遗产继承需要哪些证件或资料_百度知道 网页链接 ,,,,,2021-02-04,分享按钮,0,0,0,,
4600591370158776,K0fnP0FiU,上下班高峰，不知道哪辆破车在南北高架抛锚了拜托容易抛锚的车子以后别开出来了耽误大家回家吃饭 ,,,,,2021-02-03,iPhone客户端,0,0,0,,
4599290195869931,JFEZtoD2j,新的一年最大的愿望就是家人平安！妈妈身体健健康康，就算用我的二十年给我妈妈！ ,,https://wx4.sinaimg.cn/large/60ef5aadly1gn6e825ptgj21o0280u0x.jpg,,,2021-01-31,iPhone客户端,0,0,0,,
4591733662293410,JCupw9CCu,#央视呼吁禁止虐动物尽快立法##央视呼吁禁止虐动物尽快立法##央视呼吁禁止虐动物尽快立法##央视呼吁禁止虐动物尽快立法# 这种热搜居然还不如一些十八线明星的，这个社会怎么了？冷漠的可怕！ ,,,,,2021-01-10,小yumi的iPhone客户端,4,0,0,"央视呼吁禁止虐动物尽快立法,央视呼吁禁止虐动物尽快立法,央视呼吁禁止虐动物尽快立法,央视呼吁禁止虐动物尽快立法",
4590609074225862,JC19FhJl4,2021年希望王照蔚可以下十八层地狱！永世不得超生！这世间为什么会有这种魔鬼？老天爷你睁开眼吧，这样变态的人为什么能逍遥自在？这是个怎样的国家啊？ ,,,,,2021-01-07,小yumi的iPhone客户端,0,0,0,,
4585749276794537,JzYJhsvzj,宠物 上海11岁有芯片的萨摩耶被当街残忍棒杀！事后尸体被执法人员给了民工 芭比yumi萌萌哒的微博视频 ,,,"https://f.video.weibocdn.com/0016lV2lgx07J1TlYwer010412002E4Y0E010.mp4?label=mp4_720p&template=720x1280.24.0&trans_finger=c3f00996be5378650057cf237d7bfffd&ori=0&ps=1CwnkDw1GXwCQx&Expires=1620511775&ssig=qs7YpubOo5&KID=unistore,video",,2020-12-24,宠物超话,1,0,0,,
4585547849270269,JzTuoCTCt,心痛这样的事情在上海发生！我一直觉得我的城市是个对狗狗友好宽容的城市，是个与国际接轨的城市，是个高素质城市，可是这件事让我突然发现我错了，国际性大都市里还是有这样的无法与国际接轨的没有素质的人存在，还是执法人员！我一直觉得北上广不会有这样的野蛮人存在，可是我错了，为什么国家刚刚公开说狗狗不在可食用范围，不属于检疫范围，但是执法人员却公然把狗狗打死狗后送给民工吃？素质教育和民工一样？还知法犯法？说了不能吃还行为上鼓励他人吃？@警民直通车-浦东 @上海热线市民频道 @澎湃新闻 @上海发布 『一只叫乐乐的11岁狗狗，回不了家了』一只叫乐乐的11岁狗狗，回不了家了,,,,,2020-12-24,小yumi的iPhone客户端,0,0,0,,"警民直通车-浦东,上海热线市民频道,澎湃新闻,上海发布"
4585544003355664,JzToce4XC,来我的主页看看我的精选照片吧 芭比yumi萌萌哒的微博视频 ,,,"https://f.video.weibocdn.com/001l5m6Ygx07J0ZkurZS010412000RdQ0E010.mp4?label=mp4_720p&template=720x960.24.0&trans_finger=c3f00996be5378650057cf237d7bfffd&ori=0&ps=1CwnkDw1GXwCQx&Expires=1620511775&ssig=Dpvi6mPtaD&KID=unistore,video",,2020-12-24,小yumi的iPhone客户端,0,0,0,,
4585542786221214,JzTmeq6qa,曾经，是否有一个心仪的微博昵称摆在你面前，你却没有机会，只能看着它被别人拥有。现在机会来噜！ #抢占微博好昵称#活动隆重开启，千万炫酷好昵称，你再不来就抢光啦！抢占微博好昵称 ,,https://ww2.sinaimg.cn/large/8c1875f9jw1elyz1gpx0rj20c80it413.jpg,,,2020-12-24,微博注册,0,0,0,抢占微博好昵称,
4585541704352161,JzTkuigc9,来我的主页看看我的精选照片吧 ,,https://wx4.sinaimg.cn/large/60ef5aadgy1glyjavm7v2j20u0140tif.jpg,,,2020-12-24,,0,0,0,,
4585541595824772,JzTkjorhW,分享图片 ,,"https://wx1.sinaimg.cn/large/60ef5aadgy1glyj8xv7y7j20u0140126.jpg,https://wx4.sinaimg.cn/large/60ef5aadgy1glyj9fwadaj20u01407fd.jpg",,,2020-12-24,,0,0,0,,
