id,bid,正文,头条文章url,原始图片url,视频url,位置,日期,工具,点赞数,评论数,转发数,话题,@用户
4464565892537302,Ir5ExaE4e,#湖北累计报告新型肺炎病例729例#这个应该比非典还严重的，一开始大家不够重视，现在才知道情况严重。不过最终的感染人数应该没有非典多，因为当年的非典很晚才重视起来，而且好像也没有封城。 ,,,,,2020-01-25,iPhone客户端,0,0,0,湖北累计报告新型肺炎病例729例,
4464325961971757,IqZpy8gWx,#封城日记#非典爆发两个月，广东报告三百多例，这次2019新型肺炎好像才爆发不到两个月，武汉感染人数就累计五百多了，所以，这次的情况好像很严重啊！当然最终的死亡人数肯定没有非典多，因为重视程度比当年非典更高。 ,,"https://wx3.sinaimg.cn/large/0060E6Gggy1gb7tlqhu2nj30n01dse0n.jpg,https://wx4.sinaimg.cn/large/0060E6Gggy1gb7tlr9bi3j30n01ds7wh.jpg",,,2020-01-24,iPhone客户端,0,0,0,封城日记,
4463620698296780,IqH41yOn2,#山西确诊首例新型肺炎病例#有没有在武汉的？能说说现在那边的情况吗？大街上是不是人人都带口罩？如果不是，那那些还不戴口罩的心是有多大。如果有不戴口罩，还打喷嚏的，周围人是不是会像躲瘟疫那样躲开 ,,,,,2020-01-22,iPhone客户端,1,0,0,山西确诊首例新型肺炎病例,
4463620648175394,IqH3WyiNc,#新型冠状病毒怕酒精不耐高温#有没有在武汉的？能说说现在那边的情况吗？大街上是不是人人都带口罩？如果不是，那那些还不戴口罩的心是有多大。如果有不戴口罩，还打喷嚏的，周围人是不是会像躲瘟疫那样躲开 ,,,,,2020-01-22,iPhone客户端,0,0,0,新型冠状病毒怕酒精不耐高温,
4447913633623948,Ik6s3fcKM,分享图片 ,,,,,2019-12-10,iPhone客户端,0,0,0,,
4438732461346143,IgfBI5EbZ,#蔡徐坤同款vivo S5发布#呵呵，🐔你太美，这不就是标准的网红脸吗？你说他的脸不是整的，还真的是侮辱我的智商。 ,,,,,2019-11-15,华为P9手机摄影再突破,1,0,0,蔡徐坤同款vivo S5发布,
4438671962768048,Ige28bC5W,#香港当前最紧迫的任务#所以为什么不让评论 ,,,,,2019-11-14,华为P9手机摄影再突破,0,0,0,香港当前最紧迫的任务,
4437468465648118,IfIJ0nHkG,#香港市民与暴徒对质时被烧成火人#搞笑了，没有中国支撑，你香港小小的弹丸之地有何用？和平时期没有事，但要是战争时期，还不是得让外国人欺凌，挨打。那么点地方，炮火就能扫平你，还妄想独立建国。没乱之前，你觉得香港的日子不好过，现在乱了之后，日子更好过了？ ,,,,,2019-11-11,美图M6•自拍大明星,0,0,0,,
4437461571055806,IfIxT4qF8,#为什么一点才能付尾款#细思恐极，为什么不管是京东还是淘宝，上面的衣服模特来来去去就是那几个人？按道理，网店应该有千千万万家的，为何模特就那么多几个？ ,,,,,2019-11-11,美图M6•自拍大明星,0,0,0,为什么一点才能付尾款,
4435197363480430,IeLDWeBpY,#智能头箍售价近4000#这是强制学生买的？这么贵，贫困家庭买不起怎么办？如果说是学校免费给学生用的，那么这个学校也太舍得了吧？一千个的话就是四百万了，不可能那么大方的，难道账面写的是四千一个，实际上二千一个，学校某些人和供货商勾结，能骗了学校的二百万？ ,,,,,2019-11-05,美图M6•自拍大明星,1,0,0,智能头箍售价近4000,
4434704759234293,IeyPpCKgd,#罗永浩回应被列入老赖名单#呵呵，如果我不精日，相信还是有更多的人顶你的，可惜，你在很多人眼里永远都是罗太君。 ,,,,,2019-11-04,华为P9手机摄影再突破,0,2,0,罗永浩回应被列入老赖名单,
4434703698631830,IeyNHAdx4,#小北接陈念出狱镜头#没看过，所以这逼为什么会坐牢？ ,,,,,2019-11-04,华为P9手机摄影再突破,0,0,0,小北接陈念出狱镜头,
4433925839493157,Ieez5DPBr,#广安4名失联初中女生已找到##广安4名失联初中女生已找到#这种女基本是那种读书读不进去了，终日跟同样读书读不进去，爱抽烟，爱逃课，爱打架，爱夜不归宿，爱拉帮结伙，爱泡网吧的男的一起玩的。这种家长想管也没有用了，已经学坏了，很叛逆。你可以说我有偏见，但是我说的这种女的，男的，现实真的挺多。读书读不进去，跟家里人关系也不好，所以就想出去打工。,,,,,2019-11-01,华为P9手机摄影再突破,0,0,0,"广安4名失联初中女生已找到,广安4名失联初中女生已找到",
4433923923058559,Ieew0cPFB,#广安4名失联初中女生已找到#这种女基本是那种读书读不进去了，终日跟同样读书读不进去，爱抽烟，爱逃课，爱打架，爱夜不归宿，爱拉帮结伙，爱泡网吧的男的一起的。这种家长想管也没有用了，已经学坏了，很叛逆。 ,,,,,2019-11-01,华为P9手机摄影再突破,0,0,0,广安4名失联初中女生已找到,
4433227068235260,IdWo2yymM,#李小璐 PGone#难道没有人好奇，视频究竟是谁流出来的吗？不可能是当事人，那么是黑客入侵了？黑客是别人顾来的？还是手机被盗了，丢了？ ,,,,,2019-10-30,华为P9手机摄影再突破,0,0,0,李小璐 PGone,
4433226376716869,IdWmVsbmB,#马苏#应该想想，这三部视频是谁流出来的？屁股万或者李小璐的手机被黑客入侵了？ ,,,,,2019-10-30,华为P9手机摄影再突破,0,0,0,马苏,
4431359009822736,Id9N2Fdle,#代拍乱象#所以什么是代拍？丢，都没有营销号科普一下？ ,,,,,2019-10-25,美图M6•自拍大明星,0,0,0,代拍乱象,
4431331964267376,Id95qhU8E,#未成年人刑责年龄该降低吗#应该细分，如果是偷东西，打架那种，可以原谅。但是如果是打死人了，特别是穷凶极恶的，强奸的，谋杀的，都应该按成年人来处理。 ,,,,,2019-10-25,美图M6•自拍大明星,0,0,0,未成年人刑责年龄该降低吗,
4431076585496313,Id2rwn3Qd,#假如和三年前的自己通话#一帮在矫情的傻逼，当然是告诉我自己双色球的号码？有了钱，真的没有烦恼。 ,,,,,2019-10-25,美图M6•自拍大明星,0,0,0,假如和三年前的自己通话,
4431069874500766,Id2gHiSR0,#警方通报大连10岁女孩被杀案#这种人渣放出来，你以为会改过自新？不会的，还会犯案。会强奸杀人的都不可能会改的。 ,,,,,2019-10-25,美图M6•自拍大明星,0,0,0,警方通报大连10岁女孩被杀案,
4427356535778944,IbtFrofmM,#雪莉确认死亡#是真的自杀还是伪装自杀的谋杀？如果是谋杀估计也找不到证据 ,,,,,2019-10-14,华为P9手机摄影再突破,0,0,0,雪莉确认死亡,
4426002002568248,IaUqIaM7m,#无锡高架坍塌#六个小时过去了，还没公布具体伤亡数据？不敢公布？在掩饰什么？ ,,,,,2019-10-11,华为P9手机摄影再突破,10,4,0,无锡高架坍塌,
4420555460016939,I8CJY04pd,#王一博方否认将开泰国见面会#这逼天天上热搜，恶心的要死 ,,,,,2019-09-25,美图M6•自拍大明星,0,0,0,王一博方否认将开泰国见面会,
4417961886553323,I7xgMruOL,#你心中的动漫第一神作#龙珠 ,,,,,2019-09-18,美图M6•自拍大明星,0,0,0,你心中的动漫第一神作,
4417634164432030,I7oKciAYm,#周杰伦新歌喜提油管第一#呵呵，你说这个不是刷的，谁相信？粉丝相信？ ,,,,,2019-09-17,美图M6•自拍大明星,0,0,0,周杰伦新歌喜提油管第一,
4415802943685579,I6D6CfsMP,#吴京看胡歌的眼神#呵呵，就我觉得这是在审视，挑衅的眼神吗？ ,,,,,2019-09-12,美图M6•自拍大明星,0,0,0,吴京看胡歌的眼神,
4413514921519575,I5FAg6njh,#西政慕容云海#所以很多农村孩子去大城市大学读书，看到有钱人的世界，自卑就对了。 ,,,,,2019-09-06,华为P9手机摄影再突破,0,0,0,西政慕容云海,
4413313838238130,I5AlVyz74,#好朋友逐渐变少的原因#是你穷的原因，有句话怎么说，富在深山有远亲，穷在闹市无人理？ ,,,,,2019-09-06,华为P9手机摄影再突破,0,0,0,好朋友逐渐变少的原因,
4410283122325105,I4jvG9KRH,#马云希望下辈子做个好女人#就马云这外星人长像，如果不是有钱，连娶个媳妇都是问题。。。。。如果哪天破产了，你看看还有没有朋友 ,,,,,2019-08-28,华为P9手机摄影再突破,1,0,0,马云希望下辈子做个好女人,
4409519821840061,I3ZEy7IGp,#偷拍女生裙底学生行拘5日#在外网上看到了三个视频，感觉就是一个系列的。应该是个学校，这家伙专门偷拍中学生的？不知道有没有人认出这是哪里？不知道有没有抓住偷拍的？ ,,"https://wx3.sinaimg.cn/large/0060E6Gggy1g6czeogam6j30u01hcb29.jpg,https://wx2.sinaimg.cn/large/0060E6Gggy1g6czeqk7hrj30u01hcu0x.jpg,https://wx4.sinaimg.cn/large/0060E6Gggy1g6czet6oguj30u01hc1kx.jpg",,,2019-08-26,美图M6•自拍大明星,0,0,0,偷拍女生裙底学生行拘5日,
4407346304179451,I356Shxgv,#滕华涛称用错了鹿晗#完了，肯定被粉丝骂死了，瞎说什么大实话 ,,,,,2019-08-20,华为P9手机摄影再突破,1,0,0,滕华涛称用错了鹿晗,
4404440796511095,I1RwzrjPF,#纪梵希t恤#只是说明，在很多外国眼里，台港澳是国家，不知道是不是他们的教科书就是这样写的 ,,,,,2019-08-12,华为P9手机摄影再突破,0,0,0,纪梵希t恤,
4402356240500808,I0Zio26hy,#阿拉斯加海冰完全消融#汽车，燃烧垃圾，工厂产生的那么多气体，这些气体最终哪去了？能不能飘出地球，飘向宇宙？如果不能，那一直停留在地球内部？也太可怕了吧？ ,,,,,2019-08-06,美图M6•自拍大明星,0,0,0,阿拉斯加海冰完全消融,
4400620729127347,I0g9aCirh,#张大仙 虎牙##张大仙 虎牙# 你们猜猜，斗鱼会不会清空张大仙在斗鱼的视频？ ,,,,,2019-08-01,华为P9手机摄影再突破,0,0,0,"张大仙 虎牙,张大仙 虎牙",
4400507789180942,I0dd0CwnI,#保时捷女车主丈夫确为派出所所长#别看犯了众怒，说严查什么的，结果无非就是他老婆出来道歉，赔钱，然后就没有然后了。想查他老公？不可能。最多不痛不痒的宣布经查他老公没有违法违纪，是个好所长，你气不气？气也没有用。 ,,,,,2019-08-01,华为P9手机摄影再突破,0,0,0,保时捷女车主丈夫确为派出所所长,
4397493535699593,HEUfDnUIV,最惨的莫过于花了八个小时下载，最后发现要密码！我指的是这个妹子的资源。 ,,"https://wx3.sinaimg.cn/large/0060E6Gggy1g5am8wm21tj30pu0ygq50.jpg,https://wx3.sinaimg.cn/large/0060E6Gggy1g5am8x6nzwj30nm0vhjty.jpg",,,2019-07-24,美图M6•自拍大明星,0,1,0,,
4397388623891095,HERwqgkfB,#喜欢到循环的电视剧歌曲#呵呵，仙剑一，仙剑三的歌曲bgm，能和他们对打的几乎没有。 ,,,,,2019-07-24,华为P9手机摄影再突破,0,0,0,喜欢到循环的电视剧歌曲,
4394370427803348,HDB0mwK0s,#情侣2年前偶遇章子欣#这家店在吃人血馒头 ,,,,,2019-07-15,美图M6•自拍大明星,1,0,0,情侣2年前偶遇章子欣,
4394369886769103,HDAZusoX5,#杭州奔驰失控撞人案宣判#是立刻执行还是缓刑？虽然是六年，但可以减刑，估计坐3年就能出来了。 ,,,,,2019-07-15,美图M6•自拍大明星,0,0,0,杭州奔驰失控撞人案宣判,
4393990998652239,HDr8nAiQf,#辱骂初一女生老师道歉#迫于压力，嘴上道歉而已，内心里一直咒骂着呢，更加仇恨这个学生，恨不得杀了她那种。 ,,,,,2019-07-14,华为P9手机摄影再突破,0,0,0,,
4391789844757823,HCvS8jXJ5,#刘亦菲妆容#刘亦菲最好看的古装造型——赵灵儿 ,,https://wx2.sinaimg.cn/large/0060E6Gggy1g4sf5zpkakj30dw099q3e.jpg,,,2019-07-08,美图M6•自拍大明星,0,0,0,刘亦菲妆容,
4391308552151090,HCjlR91B0,七天了，终于从体重57减到56了。。。。早餐簸箕炊。午餐大概玉米棒两根，晚餐大概一根黄瓜。 ,,"https://wx1.sinaimg.cn/large/0060E6Gggy1g4qvu9u3m7j30u0140jvi.jpg,https://wx2.sinaimg.cn/large/0060E6Gggy1g4qvuar1rnj31400u041g.jpg",,,2019-07-07,华为P9手机摄影再突破,1,0,0,,
4391230383212982,HChjMdtQi,#Jony J 求婚#完全不认识这货 ,,,,,2019-07-07,美图M6•自拍大明星,0,0,0,Jony J 求婚,
4391024631607473,HCbXV6KaZ,#穿吊带见爱豆#合不合适我不知道，但我知道穿成这样的肯定是骚货。 ,,,,,2019-07-06,华为P9手机摄影再突破,0,0,0,穿吊带见爱豆,
4390961431922062,HCajZ8410,#它们不会垃圾分类但我们可以#搞笑了，把垃圾分类好了能改变什么?_?垃圾里最难分解的是塑料吧？其中塑料袋是最多的吧？你以为把塑料垃圾分类出来，就不会丢到海里了？该丢海里的还是丢海里，反正只要飘走，不在我的地盘就好了。这就是人的自私。 ,,,,,2019-07-06,美图M6•自拍大明星,0,0,0,它们不会垃圾分类但我们可以,
4390959703639178,HCahcfgIq,终于找到我一直抽不到的原因了。 ,,https://wx4.sinaimg.cn/large/0060E6Gggy1g4pruxaxwlj30u01hcaid.jpg,,,2019-07-06,美图M6•自拍大明星,0,0,0,,
