id,bid,正文,头条文章url,原始图片url,视频url,位置,日期,工具,点赞数,评论数,转发数,话题,@用户
4629125128782886,KcdG0AQPs,"我在#微博打卡王#活动中抽中50积分,新一轮瓜分百万的机会已开启,快来一起参与#微博打卡王#瓜分百万红包，快去打卡 ",,,,,2021-04-23,微博打卡王,0,0,0,微博打卡王,
4626721095552843,Kbd8xnixZ,"我在#微博打卡王#活动中抽中50积分,新一轮瓜分百万的机会已开启,快来一起参与#微博打卡王#瓜分百万红包，快去打卡 ",,,,,2021-04-16,微博打卡王,0,0,0,微博打卡王,
4626129857807624,KaXKVwL7q,#张韶涵高开叉造型#女神女神美翻了 ,,,,,2021-04-15,iPhone客户端,2,0,0,张韶涵高开叉造型,
4626129753473593,KaXKLezDH,#张韶涵低音有多稳#太女神了好棒哦 ,,,,,2021-04-15,iPhone客户端,1,0,0,张韶涵低音有多稳,
4625993052459848,KaUchajUY,张韶涵 太惊艳太美了，唱的好听如此性感 ,,,,,2021-04-14,张韶涵超话,10,0,0,,
4620741750031677,K8HAr08eV,#张韶涵力挺吴青峰#加油加油哦💪 ,,,,,2021-03-31,iPhone客户端,0,0,0,张韶涵力挺吴青峰,
4603536056797810,K1tZjswq6,#李佳琦千万红包犇新年#好运来袭~感谢@人民日报 和@李佳琦Austin 联手送我的暖心拜年红包！快来领走属于你的千万现金红包，一起温暖过大年人民日报 的红包 ,,,,,2021-02-11,粉丝红包,0,0,0,李佳琦千万红包犇新年,"人民日报,李佳琦Austin"
4603521360741490,K1tBC36Tw,#集福牛开福运# 福运正当头，牛年我最牛！我在福运红包中开出了 @让红包飞 送出的【2.18元】红包，新年好运连连~祝大家福气倍牛，牛气冲天！#让红包飞# 快来赞我，沾沾福气呀>>  网页链接 ,,,,,2021-02-11,红包活动,0,0,0,"集福牛开福运,让红包飞",让红包飞
4603504867943707,K1tb0xkwj,#张韶涵许绍洋18年后再同框#满满青春回忆 ,,,,,2021-02-11,iPhone客户端,0,0,0,张韶涵许绍洋18年后再同框,
4603008346497107,K1ggargc3,#张韶涵唱隐形的翅膀爷青回#满满的青春回忆 ,,,,,2021-02-10,iPhone客户端,0,0,0,张韶涵唱隐形的翅膀爷青回,
4602943712527365,K1ezVaBtX,#春晚pick站#没错！今年我最期待的春晚艺人就是@张韶涵  啦！你最想看谁的#春晚#舞台？也来为TA加牛吧！2021春晚最受期待艺人榜 ,,,,,2021-02-10,势力榜,0,0,0,"春晚pick站,春晚",张韶涵
4602632603964899,K16u8gDrZ,#春晚pick站#没错！今年我最期待的春晚艺人就是@张韶涵 啦！你最想看谁的#春晚#舞台？也来为TA加牛吧！2021春晚最受期待艺人榜 ,,,,,2021-02-09,势力榜,0,0,0,"春晚pick站,春晚",张韶涵
4601530952457568,K0DPhajkc,翻转福牛卡，马上有红包！我刚刚获得了 @EXEED星途 送出的【0.01元】。#集福牛开福运# 除夕还能瓜分1亿现金！你也快来领取福牛卡，翻转试试手气吧~好运入口>> 新春集福牛 ,,,,,2021-02-06,红包活动,0,0,0,集福牛开福运,EXEED星途
4601501370029328,K0D3z07D2,#张韶涵rap#好听真棒👍 ,,,,,2021-02-06,iPhone客户端,0,0,0,张韶涵rap,
4601129579055458,K0tnTBZJM,翻转福牛卡，马上有红包！我刚刚获得了 @EXEED星途 送出的【0.02元】。#集福牛开福运# 除夕还能瓜分1亿现金！你也快来领取福牛卡，翻转试试手气吧~好运入口>> 新春集福牛 ,,,,,2021-02-05,红包活动,0,0,0,集福牛开福运,EXEED星途
4598445098931343,JFj0pBtrV,翻转福牛卡，马上有红包！我刚刚获得了 @东风本田 送出的【0.14元】。#集福牛开福运# 除夕还能瓜分1亿现金！你也快来领取福牛卡，翻转试试手气吧~好运入口>> 新春集福牛 ,,,,,2021-01-28,红包活动,0,0,0,集福牛开福运,东风本田
4598007989025568,JF7DoBRXG,张韶涵 今年春晚会参加吗？ ,,,,,2021-01-27,张韶涵超话,6,0,0,,
4597277568018990,JEODixE6y,#张韶涵新专辑##张韶涵#很用心很不错👍不过网易独家还是喜欢用qq音乐 张韶涵新专辑上线，你感受到Angela的哪些风格突破? ,,,,,2021-01-25,iPhone客户端,0,0,1,"张韶涵新专辑,张韶涵",
4596645507901948,JEybQx9EM,我刚刚成功抽到了现金红包！小积分竟能抽大礼，机会难得戳我抽奖>> 现金红包天天拿 ,,,,,2021-01-23,微博积分,0,0,0,,
4596642877807367,JEy7BwL3h,#微博养牛事事牛# 史上最大的养牛福利！我的福牛【微博福牛】在【10级】抽到了【0.21元 和 30元护肤代金券】，简直不要太幸运啦~话不多说，赶紧做任务升级，前方还有大奖和红包等我哦~2021新年福运，就在#让红包飞# ,,,,,2021-01-23,微博品牌活动,0,0,0,"微博养牛事事牛,让红包飞",
4593763840177139,JDle00K55,#张韶涵赵磊高音好绝#配合的真棒👍 ,,,,,2021-01-15,iPhone客户端,0,0,0,张韶涵赵磊高音好绝,
4593388802282004,JDbt69zEw,#微博养牛事事牛# 史上最大的养牛福利！我的福牛【微博福牛】在【5级】抽到了【5元手机回收加价券】，简直不要太幸运啦~话不多说，赶紧做任务升级，前方还有大奖和红包等我哦~2021新年福运，就在#让红包飞# 福牛新春旅⾏记 ,,,,,2021-01-14,微博品牌活动,0,0,0,"微博养牛事事牛,让红包飞",
4593387158376608,JDbqrz98A,#官方回应大连一女子不配合防疫登记#官方回应避重就轻，为何不直接开除，官官相护 ,,,,,2021-01-14,iPhone客户端,0,0,0,官方回应大连一女子不配合防疫登记,
4591064377466211,JCd01vkiL,"我在#微博打卡王#活动中抽中50积分,新一轮瓜分百万的机会已开启,快来一起参与#微博打卡王#瓜分百万红包，快去打卡 ",,,,,2021-01-08,微博打卡王,1,0,0,微博打卡王,
4590999579919805,JCbjvFCAR,#山东春晚官宣张韶涵刘雨昕#是济南录制了吗，怎么参与去现场呢？ ,,,,,2021-01-08,iPhone客户端,7,0,0,山东春晚官宣张韶涵刘雨昕,
4588300502837290,JB36abU6K,#浙江卫视跨年节目单#没有节目单也是无语了😓 ,,,,,2020-12-31,iPhone客户端,0,0,0,浙江卫视跨年节目单,
4587566215469794,JAJZPmWWu,刚刚在积分乐园兑换了5元现金红包，如此简单，用积分就能做到！不说了我去收现金啦！积分兑红包>> 现金红包天天拿 ,,,,,2020-12-29,微博积分,0,0,0,,
4574839862201931,JvoVs9eP1,#医保局回应老人用现金交医保被拒#太心疼了，怎么能如此对待老人，可恶至极 ,,,,,2020-11-24,iPhone客户端,1,0,0,医保局回应老人用现金交医保被拒,
4565840038734281,JrCNBAEbv,#让张韶涵一个人唱吧#说出来太多人的心声 ,,,,,2020-10-30,iPhone客户端,0,0,0,让张韶涵一个人唱吧,
4562253179522405,Jq7ulDXdb,#被双11规则逼疯的我#淘宝弄个双十一总是如此复杂也是够够的，很是无语的，不买了睡觉 ,,,,,2020-10-20,iPhone客户端,1,0,0,被双11规则逼疯的我,
4549454076839389,JkKwDsHeJ,#被大学生辱骂外卖员已收到致歉#这种装逼渣渣就该开除 ,,,,,2020-09-15,iPhone客户端,0,0,0,被大学生辱骂外卖员已收到致歉,
4538909499591146,JgkdfEf5U,#张韶涵同款#已下单 ,,https://wx1.sinaimg.cn/large/7f1de659ly1ghtrnym3owj20yi1pce2d.jpg,,,2020-08-17,iPhone客户端,0,0,0,张韶涵同款,
4538887643071805,JgjE0cT7f,#张韶涵同款#买买买 ,,,,,2020-08-17,iPhone客户端,0,0,0,张韶涵同款,
4533589365231683,Je5OolWZZ,#张韶涵线上演唱会#突然结束🔚没听够，太棒太赞了👍诚意满满牛牛牛 ,,,,,2020-08-02,iPhone客户端,3,0,0,张韶涵线上演唱会,
4505886360069276,J2t880i1m,#丰巢去年巨亏近8亿元#赔钱就别干了，都是弄这个导致快递员都不送货上门，从不联系直接放柜子里，把你们柜子都撤了吧，及时止损吧 ,,,,,2020-05-18,iPhone客户端,0,0,0,丰巢去年巨亏近8亿元,
4496894451629078,IEEFn6PNs,我免费围观了 @王福重 的回答，问题价值 200.00 元，快来一起免费围观~ 微博问答 ,,,,,2020-04-23,微博 weibo.com,0,0,0,,王福重
4487145001867983,IAz2s7PWL,#天赐的声音#歌曲推荐已经开启，歌手演唱曲目由你决定，快来投票吧~天赐的声音歌曲推荐 ,,,,,2020-03-27,台网话题,0,0,0,天赐的声音,
