id,bid,正文,头条文章url,原始图片url,视频url,位置,日期,工具,点赞数,评论数,转发数,话题,@用户
4634698460432960,KeyFg1ODe,大风沙尘天气结束了，明天必定春光明媚。 ,,,,,2021-05-08,华为手机,0,0,0,,
4634363461632899,KepWW6QN5,印度疫情复杂，中国要全民同心战疫情。 ,,,,,2021-05-07,华为手机,0,0,0,,
4633867183194600,Ked2udp3O,今天又是:大风起兮尘飞扬。 ,,,,,2021-05-06,华为手机,0,0,0,,
4633644608261397,Ke7fuyFal,刚刚在积分乐园兑换了10元现金红包，如此简单，用积分就能做到！不说了我去收现金啦！积分兑红包>> 现金红包天天拿 ,,,,,2021-05-06,微博积分,0,0,0,,
4633375523209420,Ke0fudsUQ,五一劳动节吃喝玩乐防疫情，齐头并进。 ,,,,,2021-05-05,华为手机,0,0,0,,
4632896261064651,KdNMu4sXN,五一劳动节过半，到处是人潮涌动。 ,,,,,2021-05-03,华为手机,0,0,0,,
4632523206033474,KdE4MpjA6,劳动节快乐。劳动者光荣。 ,,,,,2021-05-02,华为手机,0,0,0,,
4632167907069552,KduPItF72,五一劳动节的第一天平稳度过。 ,,,,,2021-05-01,华为手机,0,0,0,,
4631825446865248,KdlVmsNXO,一阵风一阵雨，昨高温今冷气，老天也在闹脾气。 ,,,,,2021-04-30,华为手机,0,0,0,,
4631331282355537,Kd94k9SMx,大风如约而至，云飞树舞人稀。 ,,,,,2021-04-29,华为手机,0,0,0,,
4631092155909432,Kd2QDoNjq,五一临近，天气变化，多加留意，安全过节。 ,,,,,2021-04-28,华为手机,0,0,0,,
4630720461151462,KcTb84PxY,五一小长假，防疫不能松。 ,,,,,2021-04-27,华为手机,0,0,0,,
4630378289565261,KcKheE8mp,今天看了场李焕英的电影，有点闹。 ,,,,,2021-04-26,华为手机,0,0,0,,
4629926168496515,Kcyw0zEkz,距离五一劳功节愈来愈近了。 ,,,,,2021-04-25,华为手机,0,0,0,,
4629159953302850,KceAbdRdM,印度疫情恶变，8天增10万。政府欠作为，平民遭灾殃。 ,,,,,2021-04-23,华为手机,0,0,0,,
4628919997434786,Kc8l9vc7U,春雨贵如油，今天的雨让花花世界更艳丽。 ,,,,,2021-04-22,华为手机,0,0,0,,
4628565703791864,KbZ7IfUr6,打疫苗是责任。为彻底战胜新冠病毒，必须按要求全民免疫打疫苗。 ,,,,,2021-04-21,华为手机,0,0,0,,
4628180281329244,KbP645zNq,今天气温上升很快，年青人休闲背心短裤己出现在视野中。 ,,,,,2021-04-20,华为手机,0,0,0,,
4627836796931043,KbGa3t551,气温骤升，公园游人长短衫都有。 ,,,,,2021-04-19,华为手机,0,0,0,,
4627461104993938,Kbwo6kX9o,当前世界新冠疫情波涛汹涌令人窒息。中国一方独好要珍惜。 ,,,,,2021-04-18,华为手机,0,0,0,,
4627114231599609,KbnmD6I89,新冠病毒第三播在国际上造成后果比前两播还要厉害，我们千万要有足够的重视。 ,,,,,2021-04-17,华为手机,0,0,0,,
4626749797173704,KbdSPu6cU,昨天沙尘暴又一次光顾京城，大自然力量令人生畏。 ,,,,,2021-04-16,华为手机,0,0,0,,
4626262746990056,Kb1dgtkqQ,玉渊潭樱花年年开，游人如织岁岁来。 ,,,,,2021-04-15,华为手机,0,0,0,,
4625999452702134,KaUmBbkWO,公园内游人如织，人多的有拥挤感。 ,,,,,2021-04-14,华为手机,0,0,0,,
4625662478123296,KaLB5y5eU,美日勾结，黑白不分，无信无义，天良丧尽，自食其果。 ,,,,,2021-04-13,华为手机,0,0,0,,
4625220110126806,KaA5B0wZg,今天打了第二针新冠疫苗，为祖国防疫取得的成果而骄傲。 ,,,,,2021-04-12,华为手机,0,0,0,,
4624584546195235,KajyupZF9,打疫苗，支持国家防疫。 ,,,,,2021-04-10,华为手机,0,0,0,,
4624107088646426,Ka78oAhku,全国疫情向好（云南个例），火车旅客渐多。 ,,,,,2021-04-09,华为手机,0,0,0,,
4623833703384221,Ka01secod,积极打疫苗，防控是根本。 ,,,,,2021-04-08,华为手机,0,0,0,,
4623381552693420,K9OgbbiGg,风轻云淡，桃红柳绿，莺歌燕舞，春意盎然。 ,,,,,2021-04-07,华为手机,0,0,0,,
4623051269081320,K9FFsC6sU,浮躁中求安稳，实在不容易。 ,,,,,2021-04-06,华为手机,0,0,0,,
4621260749800098,K8V5wF7s6,4月第一天，山西全省阴雨绵绵。 ,,,,,2021-04-01,华为手机,0,0,0,,
4620229810586775,K8ugJ2sE7,都在向往明天，明天要比今天好。 ,,,,,2021-03-29,华为手机,0,0,0,,
4619515579859946,K8bGJFn1o,城墙环带公园游人如织，春天的美景引人入胜。 ,,,,,2021-03-28,华为手机,0,0,0,,
4619511553071068,K8bAfcSVm,刚刚在积分乐园兑换了10元现金红包，如此简单，用积分就能做到！不说了我去收现金啦！积分兑红包>> 现金红包天天拿 ,,,,,2021-03-28,微博积分,0,0,0,,
4619508997950945,K8bw7xmp3,塞上春来迟迟，桃红柳绿不缺席。 ,,,,,2021-03-27,华为手机,0,0,0,,
4618882822701284,K7VeabkJ6,良好的睡眠，饱满的精神，愉悦的心情，美好的一天。 ,,,,,2021-03-26,华为手机,0,0,0,,
4618774759872872,K7SpRFqnS,文瀛湖春到，嫩绿染柳梢。 ,,,,,2021-03-25,华为手机,0,0,0,,
4618405376433607,K7IO5qZFR,忙忙碌碌又一天。忙中有乐，碌中充实。 ,,,,,2021-03-24,华为手机,0,0,0,,
4618057009862332,K7zKcFnDS,国家的希望在青少年。一切为青少年的成长助力。 ,,,,,2021-03-23,华为手机,0,0,0,,
4617553986721437,K7mESscyh,保证睡眠，提高免疫，战胜新冠。 ,,,,,2021-03-22,华为手机,0,0,0,,
4617334180284894,K7gWm1c74,疾风扫雾霾，细雨绿柳条。 ,,,,,2021-03-21,华为手机,0,0,0,,
4616965802693439,K77mcbiGz,大风起，雾霾除，天空蓝，心情好。 ,,,,,2021-03-20,华为手机,0,0,0,,
4616480237029201,K6UJ1tuCd,又一场风雨沙尘交加的天气正在蕴酿中。双休日在家安然静待。 ,,,,,2021-03-19,华为手机,0,0,0,,
4616216855448660,K6NSdmRrC,响应号召，今天打了疫苗。感恩。 ,,,,,2021-03-18,华为手机,0,0,0,,
4615760305458734,K6BZQmU46,迎春花开了，柳芽绿了，玉兰含苞枝头，春天的脚步在加快。 ,,,,,2021-03-17,华为手机,0,0,0,,
4615131781138368,K6lE64M8M,3.15好。点赞支持。 ,,,,,2021-03-15,华为手机,0,0,0,,
4614697317303061,K6alluDRj,二月二龙抬头。中国龙昂首向前。 ,,,,,2021-03-14,华为手机,0,0,0,,
4614415658517936,K6313zJU4,能打疫苗的一定要打。全球放开是必然的，原来严防死守是没有疫苗。 ,,,,,2021-03-13,华为手机,0,0,0,,
4614067094820892,K5TWRke8k,细雨绵绵，润泽万物，桃红柳绿，莺歌燕舞。 ,,,,,2021-03-12,华为手机,0,0,0,,
4613610377315348,K5I4duH3u,两会结束了。疫情好转了，天气渐暖了，生活正常了，生产恢复了。 ,,,,,2021-03-11,华为手机,0,0,0,,
4613231840070180,K5ydG0ifW,又是雾霾严重，再盼疾风扫除。 ,,,,,2021-03-10,华为手机,0,0,0,,
4612863463528285,K5oDweNRP,春风起绿色浓。 ,,,,,2021-03-09,华为手机,0,0,0,,
4612557350113336,K5gFN0tu0,祝全国妇女节日快乐。 ,,,,,2021-03-08,华为手机,0,0,0,,
4612119549184442,K55hECxia,多天的阴冷、雾霾终于消散。 ,,,,,2021-03-07,华为手机,0,0,0,,
4611708931018728,K4UBn4h16,祝两会圆满成功。 ,,,,,2021-03-06,华为手机,0,0,0,,
4611492802202430,K4OYM9eX4,预祝两会圆满成功，预祝会后国内防疫生产双跃进。 ,,,,,2021-03-05,华为手机,0,0,0,,
4611081886498925,K4Ei0rgFn,祝贺两会成功召开。 ,,,,,2021-03-04,华为手机,0,0,0,,
4610442918632236,K4nFpAdDC,京城春早。三月迎春花报春柳芽吐绿。 ,,,,,2021-03-02,华为手机,0,0,0,,
4610063228735638,K4dN0AExo,前行路上，除了比赛，还有友谊。 ,,,,,2021-03-01,华为手机,0,0,0,,
4609348351563033,K3VbZ6yCd,星期一开学。值得庆贺。防疫巨大成效。 ,,,,,2021-02-27,华为手机,0,0,0,,
4608997674715169,K3M4njMD7,元宵快乐。全国人民共欢庆。 ,,,,,2021-02-26,华为手机,0,0,0,,
4608635882441410,K3CEQaf7A,正月十四，稻香村购元宵排长队，但秩序井然保证供应。 ,,,,,2021-02-25,华为手机,0,0,0,,
4608077574445244,K3o8liEpu,动物园春来早，绿芽浓艳染柳梢。 ,,,,,2021-02-24,华为手机,0,0,0,,
4607852050390182,K3igB1Dvg,晚饭做的水煎包，大人孩子都爱吃，成就感滿滿。 ,,,,,2021-02-23,华为手机,0,0,0,,
4607793586506746,K3gKiriHw,牛年春早，气象万千。 ,,,,,2021-02-23,华为手机,0,0,0,,
4607413447822517,K36RawOZD,寒冬渐行渐远，艳春俏步走来。 ,,,,,2021-02-22,华为手机,0,0,0,,
4607183830913047,K30SP3Pwz,春节还有正月十五灯节丶元宵节才算过全。 ,,,,,2021-02-21,Android客户端,0,0,0,,
4606801573839227,K2QWhg6L1,全国疫情稳定向好。可贺。 ,,,,,2021-02-20,Android客户端,0,0,0,,
4606382852802636,K2G2VbL5O,初八游八仙，民俗很热闹。 ,,,,,2021-02-19,Android客户端,0,0,0,,
4605974645841428,K2vqwovCA,初七吃面条，长顺。 ,,,,,2021-02-18,Android客户端,0,0,0,,
4605609700497482,K2lVU25pU,初六天天顺。 ,,,,,2021-02-17,Android客户端,0,0,0,,
4605375704473992,K2fQuiLTa,破五的饺子真香。 ,,,,,2021-02-16,Android客户端,0,0,0,,
4605010393178137,K26lhdkMh,明天破五，明天吃水饺。 ,,,,,2021-02-15,Android客户端,0,0,0,,
4604634092025343,K1Wyl8uSP,牛年开局平稳，为全年发展打下良好的基础。 ,,,,,2021-02-14,Android客户端,0,0,0,,
4604171087778430,K1KvywDwy,正月初二回娘家。初一的饺子，初二的面。 ,,,,,2021-02-13,Android客户端,0,0,0,,
4603789006866769,K1AzisOml,拜年了。春节快乐。 ,,,,,2021-02-12,Android客户端,0,0,0,,
4602833582429351,K1bIiabZ5,北京防疫工作的又一成就，重新返回低风险地区。 ,,,,,2021-02-09,Android客户端,0,0,0,,
4602473505621747,K12lwnAtl,洗去风过尘，迎接春节。 ,,,,,2021-02-08,Android客户端,0,0,0,,
4602113268909141,K0SYuBnFP,为了明天，高兴。 ,,,,,2021-02-07,Android客户端,0,0,0,,
4601753154368140,K0JBFiklS,数天数，迎春节。 ,,,,,2021-02-06,Android客户端,0,0,0,,
4601385449172294,K0A2ACu8e,过了23小年，迎接大年的忙忙碌碌开始了。 ,,,,,2021-02-05,Android客户端,0,0,0,,
4601384207135473,K0A0AtWgh,#集福牛开福运# 开年惊喜~我收到了 @让红包飞 送我的#强壮如牛#福牛卡，离除夕分1亿的小目标又进了一步！集齐6种福牛卡，除夕分1亿，最高能赢2021元！收集新年好福运吧！#让红包飞# 快戳>> 新春集福牛 ,,,,,2021-02-05,红包活动,0,0,0,"集福牛开福运,强壮如牛,让红包飞",让红包飞
4601384094141545,K0A0phnp7,#集福牛开福运# 开年惊喜~我收到了 @让红包飞 送我的#桃花好牛#福牛卡，离除夕分1亿的小目标又进了一步！集齐6种福牛卡，除夕分1亿，最高能赢2021元！收集新年好福运吧！#让红包飞# 快戳>> 新春集福牛 ,,,,,2021-02-05,红包活动,0,0,0,"集福牛开福运,桃花好牛,让红包飞",让红包飞
4601008011348351,K0qdP5ELB,今天过小年，家人聚团圆。 ,,,,,2021-02-04,Android客户端,0,0,0,,
4600661481891778,K0hcU7W8y,今无吃薄饼卷豆芽，咬春。 ,,,,,2021-02-03,Android客户端,0,0,0,,
4600298360800907,K07Le3mlR,快到小年了，大年也不远了。 ,,,,,2021-02-02,Android客户端,1,0,0,,
4600296754390667,K07IDiqdd,#集福牛开福运# 开年惊喜~我收到了 @让红包飞 送我的#强壮如牛#福牛卡，离除夕分1亿的小目标又进了一步！集齐6种福牛卡，除夕分1亿，最高能赢2021元！收集新年好福运吧！#让红包飞# 快戳>> 新春集福牛 ,,,,,2021-02-02,红包活动,0,0,0,"集福牛开福运,强壮如牛,让红包飞",让红包飞
4599930074965985,JFVDxkPSx,大风降温，注意防寒保暖。 ,,,,,2021-02-01,华为手机,0,0,0,,
4599211104931134,JFCVUkGOq,疫情渐稳，不可轻心。 ,,,,,2021-01-30,华为手机,0,0,0,,
4598826004656744,JFsUMjxqM,一花不是春，万紫千红春满园。 ,,,,,2021-01-29,华为手机,0,0,0,,
4597390701756806,JERzM7n1A,今日京城降雪走了过场。 ,,,,,2021-01-25,华为手机,0,0,0,,
4597040493112401,JEIsVd3G1,京城将迎来一场真正的降雪。 ,,,,,2021-01-24,华为手机,0,0,0,,
4595920253750675,JEfk5fJIL,特朗普留给世界一种极特殊的记忆。 ,,,,,2021-01-21,华为手机,1,0,0,,
4594791075809924,JDLWPonqs,祝愿河北早日好转，人民幸福安康。 ,,,,,2021-01-18,华为手机,0,0,0,,
4594472006723857,JDDEcsdbj,河北疫情紧，北京蔬菜贵。愿河北疫情早日好转。 ,,,,,2021-01-17,华为手机,0,0,0,,
4594014814738366,JDrKNjSFg,特朗普将要下台，在众目睽睽下退位。 ,,,,,2021-01-16,华为手机,0,0,0,,
4593767119862093,JDljhFnA1,石家庄疫情令全国人民担心。快些好转吧。 ,,,,,2021-01-15,华为手机,0,0,0,,
4593278634176038,JD8Bphwns,阳光照耀下的石家庄，必将战胜阴霾新冠病毒。 ,,,,,2021-01-14,华为手机,0,0,0,,
4593025378419664,JD20Vzkl2,盼望着新冠病毒药到病除的那一天。 ,,,,,2021-01-13,华为手机,0,0,0,,
4592684796481289,JCT9Brc4V,疫情趋紧，防疫得力，民心所安。 ,,,,,2021-01-12,华为手机,0,0,0,,
4592319402352394,JCJEg9RXQ,防疫重于天。 ,,,,,2021-01-11,华为手机,0,0,0,,
4591945910850271,JCzVR3zc3,石家庄昨天增40例，形势严峻，抓紧防扩散。 ,,,,,2021-01-10,华为手机,0,0,0,,
4591578168166712,JCqmIygxa,严冬到了，春天还远吗？ ,,,,,2021-01-09,华为手机,0,0,0,,
4591231579987298,JChlHFU9s,三九四九冰上走， 今天是三九第一天，真正寒冬开启了。 ,,,,,2021-01-08,华为手机,0,0,0,,
4590854956130661,JC7yfpIRD,疫情有反复，经验更完善，措施很到位，结果定圆满。 ,,,,,2021-01-07,华为手机,0,0,0,,
4590511011402153,JBYBv5SLn,疫情趋紧，做好防护，听从指挥，少添麻烦。 ,,,,,2021-01-06,华为手机,0,0,0,,
4590126137346440,JBOAJuP8Y,又是一场寒流，大风气温骤降。穿保暖，防护高空坠物。 ,,,,,2021-01-05,华为手机,0,0,0,,
4589745864443480,JBEHoiDX2,二九接三九，严寒复冰封，吃好加穿暖，行动要稳健。 ,,,,,2021-01-04,华为手机,0,0,0,,
4589424870174514,JBwlF0JoK,今年是中国共产党百年大庆。 ,,,,,2021-01-03,华为手机,0,0,0,,
4588995760361941,JBlby1w9L,告别2O20，跨入2021，中国在前进。 ,,,,,2021-01-02,华为手机,0,0,0,,
4588588638932494,JBaATBtKu,跨入了2021年，元旦快乐。 ,,,,,2021-01-01,华为手机,0,0,0,,
4588338834590130,JB45Zjg6m,告别2020，迎接2021。 ,,,,,2020-12-31,华为手机,0,0,0,,
4587761861925193,JAP5o84Pv,新冠病毒肆虐，全球迎来灾难，堪比世界大战。 ,,,,,2020-12-30,华为手机,0,0,0,,
4587606988039824,JAL3AxJwA,岁末年初，寒流如约，疫情反复，车隐人稀。 ,,,,,2020-12-29,华为手机,0,0,0,,
4587132196755070,JAyHNsliK,年尾，疫情趋紧，寒流来袭，防寒保暖，平安跨年。 ,,,,,2020-12-28,华为手机,1,0,0,,
4586463503589078,JAhjgf3Gm,防疫重于山，可严不可松。 ,,,,,2020-12-26,华为手机,0,0,0,,
4585941841482114,JA3JS6dz4,爱护关节，尊重规律，适当运动，健康快乐。 ,,,,,2020-12-25,华为手机,0,0,0,,
4585785666578543,JzZFYrBnx,愿人类在2021战胜新冠病毒。 ,,,,,2020-12-24,华为手机,0,0,0,,
4585414859437259,JzQ1TDB3R,大风过后是降温，添衣保暖过寒冬。 ,,,,,2020-12-23,华为手机,0,0,0,,
4585025117623929,JzFThvZkB,23号大风蓝色预警。外出防高空坠物。 ,,,,,2020-12-22,华为手机,0,0,0,,
4584465990944518,Jzrlt3XIa,冬至大如年，冬至快乐。 ,,,,,2020-12-21,华为手机,0,0,0,,
4584106686152913,JzhZWpOEx,环境传染。疫情到了关键时期，彻底解决要看疫苗。 ,,,,,2020-12-20,华为手机,0,0,0,,
4583962427786168,JzefgwFxm,疫情趋紧，防疫严肃，口罩洗手，远离闹市。 ,,,,,2020-12-19,华为手机,0,0,0,,
4583617919987196,Jz5hBFU7O,疫情不乐观，外出要小心。口罩必须带，洗手不马虎。 ,,,,,2020-12-18,华为手机,0,0,0,,
4583183440418982,JyTYQ1KZM,晚上吃肉沫豆芽炒饼丝。脆、香。 ,,,,,2020-12-17,华为手机,0,0,0,,
4582893395116280,JyMr1lsYE,北京动物园游人稀少。一是天寒，二是疫情。 ,,,,,2020-12-16,华为手机,0,0,0,,
4582534760904590,JyD6A3Nka,步入严冬，防寒保暖。 ,,,,,2020-12-15,华为手机,0,0,0,,
4581716918541351,JyhPtzPZJ,冬天大风，除霾降温。 ,,,,,2020-12-13,华为手机,0,0,0,,
4581188410802856,Jy4533mRi,好奇心太费时间。 ,,,,,2020-12-12,华为手机,0,0,0,,
4581071876266834,Jy135qihY,期待着多灾多难庚子年平安渡过。 ,,,,,2020-12-11,华为手机,0,0,0,,
4580724315790819,JxS0voisj,一首歌动人心魄，可以传唱全球。 ,,,,,2020-12-10,华为手机,0,0,0,,
4580001364321432,Jxzcsi8cw,气温略有回升。 ,,,,,2020-12-08,华为手机,0,0,0,,
4579393211469212,Jxjnz6acY,大雪到，严冬俏。 ,,,,,2020-12-07,华为手机,0,0,0,,
4579122955947972,JxclFoXl2,气温在上升。这是严冬给的一次喘息。 ,,,,,2020-12-06,华为手机,0,0,0,,
4578917434276020,Jx70bhWo4,为人民服务是宗旨。 ,,,,,2020-12-05,华为手机,0,0,0,,
4578542421017325,JwXfk4gEt,寒冬光顾动物园。 ,,,,,2020-12-04,华为手机,0,0,0,,
4577984679774661,JwIJJF0PP,秋天雨，冬天风。 ,,,,,2020-12-03,华为手机,0,0,0,,
4577812662978427,JwEgicuP9,迎接入冬后第一场强降温。 ,,,,,2020-12-02,华为手机,1,0,0,,
4577462412917673,Jwv9ncf1f,北方又在运酿着一场雨雪。 ,,,,,2020-12-01,华为手机,0,0,0,,
4577091603665801,JwlvifnDP,十一月最后一天。 ,,,,,2020-11-30,华为手机,0,0,0,,
4576740582889276,Jwcn8c7De,今天是气温回升的一天。 ,,,,,2020-11-29,华为手机,0,0,0,,
4576366164978905,Jw2DekTeV,冬天的步伐沉着坚定。 ,,,,,2020-11-28,华为手机,0,0,0,,
4575851763731771,JvPfyfENR,入冬以来，早晨最冷的一天。 ,,,,,2020-11-27,华为手机,0,0,0,,
4575405787056847,JvDEetBO7,家有贤妻夫祸少。 ,,,,,2020-11-26,华为手机,0,0,0,,
4575070150724587,JvuUT32uT,可上九天揽月。月土一份放在湖南，告慰毛主席，符合全国人民的心愿。 ,,,,,2020-11-25,华为手机,0,0,0,,
4574702825112817,Jvlmqls4N,早晨看公交缓慢移动，更体现出轻轨、地铁的高效便捷。 ,,,,,2020-11-24,华为手机,0,0,0,,
4574553651546125,JvhtP6udv,读书就像吃饭睡觉一样必不可少。 ,,,,,2020-11-23,华为手机,0,0,0,,
4574082693344409,Jv5ede225,调整心态和装备，迎对严冬酷冷。 ,,,,,2020-11-22,华为手机,0,0,0,,
4573602009319776,JuSIUD6uY,严寒下重保暖、护心肺养肝肾。 ,,,,,2020-11-21,华为手机,0,0,0,,
4573221157864529,JuIODwZVf,头痛医头，脚痛医脚。 ,,,,,2020-11-20,华为手机,0,0,0,,
4572999909118921,JuD3MCgfn,刚刚在积分乐园兑换了5元现金红包，如此简单，用积分就能做到！不说了我去收现金啦！积分兑红包>> 现金红包天天拿 ,,,,,2020-11-19,微博积分,0,0,0,,
4572998255774689,JuD17oeg9,冬雨小试已毕，迈向风雪疯狂。 ,,,,,2020-11-19,华为手机,0,0,0,,
4572526074398497,JuqJxisfv,冬雨撒京城，加衣保暖重。 ,,,,,2020-11-18,华为手机,0,0,0,,
4572167897355701,JuhpPuRyl,入冬的第一场雨雪如期光临京城。 ,,,,,2020-11-17,华为手机,0,0,0,,
4571791379404128,Ju7CxDsru,做好准备迎接入冬的第一场雨雪和降温。 ,,,,,2020-11-16,华为手机,0,0,0,,
4571476679990147,JtZqXFUTp,新闻天天看，认知永新鲜。 ,,,,,2020-11-15,华为手机,1,0,0,,
4571070684988153,JtOS8kVE5,进入寒冬，加强保暖。 ,,,,,2020-11-14,华为手机,1,0,0,,
4570887922124689,JtK7m8UJb,心情好。一是调控，二是保持。 ,,,,,2020-11-13,华为手机,0,0,0,,
4570451621708431,JtyLE7arl,尼克松时代结束了。特朗普拜登时代启动了。 ,,,,,2020-11-12,华为手机,0,0,0,,
4569977250907585,Jtmqx3O6t,双11必买爆款尽在双11爆款榜双11爆款榜，进入会场转发博文即可得现金红包。同时微博官方在线#寻找双11鲤鲤子#，点击话题参与，还有品牌惊喜奖品拿到手软！#双11爆款榜#双十一财富大流动。牛！ ,,,,,2020-11-11,华为手机,0,0,0,"寻找双11鲤鲤子,双11爆款榜",
4569830236364615,JtiBpqHJ5,文瀛湖畔芦花美、杨柳黄。 ,,,,,2020-11-10,华为手机,0,0,0,,
4569252680699210,Jt3zS2VTA,双11必买爆款尽在双11爆款榜双11爆款榜，进入会场转发博文即可得现金红包。同时微博官方在线#寻找双11鲤鲤子#，点击话题参与，还有品牌惊喜奖品拿到手软！#双11爆款榜#吃为天。安排好每日食谱为自己健康负责。 ,,,,,2020-11-09,华为手机,0,0,0,"寻找双11鲤鲤子,双11爆款榜",
4568937138750274,JsVmVAIls,双11必买爆款尽在双11爆款榜双11爆款榜，进入会场转发博文即可得现金红包。同时微博官方在线#寻找双11鲤鲤子#，点击话题参与，还有品牌惊喜奖品拿到手软！#双11爆款榜#冬季无风晴好，长足郊外赏冬。 ,,,,,2020-11-08,华为手机,0,0,0,"寻找双11鲤鲤子,双11爆款榜",
4568651573239313,JsNWldAGZ,双11必买爆款尽在双11爆款榜双11爆款榜，进入会场转发博文即可得现金红包。同时微博官方在线#寻找双11鲤鲤子#，点击话题参与，还有品牌惊喜奖品拿到手软！#双11爆款榜#立冬：告别秋实，迎来肃白。 ,,,,,2020-11-07,华为手机,0,0,0,"寻找双11鲤鲤子,双11爆款榜",
4568384916691256,JsH0fs4Hu,双11必买爆款尽在双11爆款榜双11爆款榜，进入会场转发博文即可得现金红包。同时微博官方在线#寻找双11鲤鲤子#，点击话题参与，还有品牌惊喜奖品拿到手软！#双11爆款榜#理财收入比工资高，如何让人爱岗敬业。 ,,,,,2020-11-06,华为手机,0,0,0,"寻找双11鲤鲤子,双11爆款榜",
4567802842712662,JsrRqbnGC,双11必买爆款尽在双11爆款榜双11爆款榜，进入会场转发博文即可得现金红包。同时微博官方在线#寻找双11鲤鲤子#，点击话题参与，还有品牌惊喜奖品拿到手软！#双11爆款榜#天寒地冻，注意穿衣保暖。 ,,,,,2020-11-05,华为手机,0,0,0,"寻找双11鲤鲤子,双11爆款榜",
4567434613228401,JsihvdxQZ,双11必买爆款尽在双11爆款榜双11爆款榜，进入会场转发博文即可得现金红包。同时微博官方在线#寻找双11鲤鲤子#，点击话题参与，还有品牌惊喜奖品拿到手软！#双11爆款榜#一泻千里……爽。 ,,,,,2020-11-04,华为手机,0,0,0,"寻找双11鲤鲤子,双11爆款榜",
4566713481299677,JrZwo5s6x,双11必买爆款尽在双11爆款榜双11爆款榜，进入会场转发博文即可得现金红包。同时微博官方在线#寻找双11鲤鲤子#，点击话题参与，还有品牌惊喜奖品拿到手软！#双11爆款榜#双十一好。打假维权很重要。 ,,,,,2020-11-02,华为手机,1,0,0,"寻找双11鲤鲤子,双11爆款榜",
4566380077128474,JrQQDtUro,双11必买爆款尽在双11爆款榜双11爆款榜，进入会场转发博文即可得现金红包。同时微博官方在线#寻找双11鲤鲤子#，点击话题参与，还有品牌惊喜奖品拿到手软！#双11爆款榜#又见文瀛湖森林公园。 ,,,,,2020-11-01,华为手机,1,0,0,"寻找双11鲤鲤子,双11爆款榜",
4566020054062163,JrHtXh2KL,双11必买爆款尽在双11爆款榜双11爆款榜，进入会场转发博文即可得现金红包。同时微博官方在线#寻找双11鲤鲤子#，点击话题参与，还有品牌惊喜奖品拿到手软！#双11爆款榜#近似疯狂的双十一，失去理智的双十一。 ,,,,,2020-10-31,华为手机,0,0,0,"寻找双11鲤鲤子,双11爆款榜",
4565617938793930,Jrx1nATHA,双十一/双十二。中国特色商业大餐。 ,,,,,2020-10-30,华为手机,0,1,0,,
4565316242247668,JrpaM9qII,双11全国商家，全民买家的狂欢日。 ,,,,,2020-10-29,华为手机,0,0,0,,
4564889018304645,Jre3HyQpT,通货膨胀，误国害民。 ,,,,,2020-10-28,华为手机,0,0,0,,
4564607030804332,Jr6IT3nf6,迈向11月，又见双十一。 ,,,,,2020-10-27,华为手机,0,1,0,,
4564181439484442,JqVErDNkS,重阳在相互祝愿声中渡过。岁岁重阳多重阳，人寿年丰庆国强。 ,,,,,2020-10-26,华为手机,0,0,0,,
4563927771645432,JqP3j6U3e,等待才知时长。 ,,,,,2020-10-25,华为手机,0,0,0,,
4563449985895633,JqCCGoJIR,民以食为天，国以粮为安。 ,,,,,2020-10-24,华为手机,1,0,0,,
4563091579208366,JqtiBCDw2,鹰击长空，鱼翔浅底，万类霜天竞自由。美妙深秋。 ,,,,,2020-10-23,华为手机,0,0,0,,
4562715353548249,JqjvNeT3P,老将至，饭量减，行动迟，思绪乱，言语讷，听力迷。 ,,,,,2020-10-22,华为手机,0,0,0,,
4562564812379630,JqfAZ9Z38,塞外天寒，暖气暖心。 ,,,,,2020-10-21,华为手机,0,0,0,,
4562034567677715,Jq1NKwdk7,北京又将迎来一场隆温。 ,,,,,2020-10-20,华为手机,0,0,0,,
4561664525473766,JpSaUmXYy,向着文瀛湖出发，观赏秋山秋湖景。 ,,,,,2020-10-19,华为手机,0,0,0,,
4561282159875466,JpIebFr3I,提前供暖，深得民心。 ,,,,,2020-10-18,华为手机,1,0,0,,
4560917377063433,JpyJPtDwl,出去走走，提神醒脑。 ,,,,,2020-10-17,华为手机,0,0,0,,
4560547801203478,Jpp7K534W,九九重阳，敬老为尚 ,,,,,2020-10-16,华为手机,0,0,0,,
4560193071094453,JpfTB4AIt,天冷盼:供暖。 ,,,,,2020-10-15,华为手机,0,0,0,,
4559820478481077,Jp6cDzAjz,今日城墙环带公园行走去也。 ,,,,,2020-10-14,华为手机,0,0,0,,
4559625850463466,Jp18J1Wzg,深秋将至，塞上风寒。 大同·卧虎湾小区 ,,,,大同·卧虎湾小区,2020-10-13,华为手机,0,0,0,,
4559316973524568,JoT6xeMTS,今天星期一，全家 ,,,,,2020-10-12,华为手机,0,0,0,,
4558899741201056,JoIfA52rS,#带着微博去旅行#长假已过，生活工作走向正轨。 ,,,,,2020-10-11,华为手机,0,0,0,带着微博去旅行,
4558371355886173,JouvloHgh,#带着微博去旅行#睁开眼面对世间的一切。 ,,,,,2020-10-10,华为手机,0,0,0,带着微博去旅行,
4558015079124334,JoleHChEG,#带着微博去旅行#长假已过，安心生活，愉快工作。 ,,,,,2020-10-09,华为手机,0,1,0,带着微博去旅行,
4557651318673044,JobLZAofO,#带着微博去旅行#长假最后一天，收心，养神，清洁。 ,,,,,2020-10-08,华为手机,0,0,0,带着微博去旅行,
4557288855570357,Jo2lnnn6t,#带着微博去旅行#寒露因寒生露。 ,,,,,2020-10-07,华为手机,0,0,0,带着微博去旅行,
