id,bid,正文,头条文章url,原始图片url,视频url,位置,日期,工具,点赞数,评论数,转发数,话题,@用户
4597316507672369,JEPE6wbVT,#上海14天隔离期间发现复阳病例30多例#造谣必死好吧，有没有点道德心了 九江·永修县 ,,,,九江·永修县,2021-01-25,OPPO Reno Ace,0,0,0,上海14天隔离期间发现复阳病例30多例,
4593302756396895,JD9ejqQ7J,思麦 ,,,,,2021-01-14,OPPO Reno Ace,0,0,0,,
4561426557702927,JpLZ5wjSL,噢这该死的恋爱脑 ,,,,,2020-10-18,OPPO Reno Ace,0,0,0,,
4539637521719374,JgD9u7dhQ,看蕉姐的隐杀，看到我泪目了，感情太细腻了，这特么是韩剧的套路啊，蕉姐你太会了，哎上头了上头了，都给我哭。 济南 ,,https://wx1.sinaimg.cn/large/007Ekg9Dly1ghw3a0wz2fj30hs0hsjs6.jpg,,济南,2020-08-19,OPPO Reno Ace,0,0,0,,
4535702517461218,JeYMHvj0e,反正她都不难受，我只要自由，喔喔喔！ ,,https://wx1.sinaimg.cn/large/007Ekg9Dly1ghjjc6smlhj30u0140q6f.jpg,,,2020-08-08,OPPO Reno Ace,0,0,0,,
4526623191374574,JbaAD5LAy,在追隐杀，前期看时：嗯，这小说不错，蕉姐情感写得很细腻，很赞；看到中期：卧槽，顾家明能不能不要那么装逼啊，简直是我了个去，全世界女的围着男主转，男主还特么天下无敌第一大杀手，论装逼还是蕉姐的家明装逼，家明哥哥，能正经做个人好吗。 济南 ,,,,济南,2020-07-14,OPPO Reno Ace,1,1,0,,
4522190857662458,J9jhHw9m2,看了隐杀，不得不说，香蕉在细腻的感情上描写得太好了，生活中的点点滴滴，md 为香蕉大大点个赞 济南 ,,,,济南,2020-07-02,OPPO Reno Ace,1,0,0,,
4520400018477053,J8yHfzzgF,#今天星期几 好想吻你呀#让我有种回到了上个世纪读散文的感觉，字里行间都充斥着一股随意，妙极了！ 济南 ,,,,济南,2020-06-27,OPPO Reno Ace,0,0,0,今天星期几 好想吻你呀,
4517290537771077,J7fNXwBBX,突然发现微博也是个发牢骚的好地方，可以可以 杭州·杭州电子科技大学（下沙校区） ,,,,杭州·杭州电子科技大学（下沙校区）,2020-06-18,OPPO Reno Ace,2,0,0,,
